leagueId,seasonYear,gameDate,gameId,gameCode,gameStatus,gameStatusText,gameSequence,gameDateEst,gameTimeEst,gameDateTimeEst,gameDateUTC,gameTimeUTC,gameDateTimeUTC,awayTeamTime,homeTeamTime,day,monthNum,weekNumber,weekName,ifNecessary,seriesGameNumber,gameLabel,gameSubLabel,seriesText,arenaName,arenaState,arenaCity,postponedStatus,branchLink,gameSubtype,isNeutral,homeTeam_teamId,homeTeam_teamName,homeTeam_teamCity,homeTeam_teamTricode,homeTeam_teamSlug,homeTeam_wins,homeTeam_losses,homeTeam_score,homeTeam_seed,awayTeam_teamId,awayTeam_teamName,awayTeam_teamCity,awayTeam_teamTricode,awayTeam_teamSlug,awayTeam_wins,awayTeam_losses,awayTeam_score,awayTeam_seed,pointsLeaders_0_personId,pointsLeaders_0_firstName,pointsLeaders_0_lastName,pointsLeaders_0_teamId,pointsLeaders_0_teamCity,pointsLeaders_0_teamName,pointsLeaders_0_teamTricode,pointsLeaders_0_points,pointsLeaders_1_personId,pointsLeaders_1_firstName,pointsLeaders_1_lastName,pointsLeaders_1_teamId,pointsLeaders_1_teamCity,pointsLeaders_1_teamName,pointsLeaders_1_teamTricode,pointsLeaders_1_points,pointsLeaders_2_personId,pointsLeaders_2_firstName,pointsLeaders_2_lastName,pointsLeaders_2_teamId,pointsLeaders_2_teamCity,pointsLeaders_2_teamName,pointsLeaders_2_teamTricode,pointsLeaders_2_points,pointsLeaders_3_personId,pointsLeaders_3_firstName,pointsLeaders_3_lastName,pointsLeaders_3_teamId,pointsLeaders_3_teamCity,pointsLeaders_3_teamName,pointsLeaders_3_teamTricode,pointsLeaders_3_points,nationalBroadcasters_broadcasterScope,nationalBroadcasters_broadcasterMedia,nationalBroadcasters_broadcasterId,nationalBroadcasters_broadcasterDisplay,nationalBroadcasters_broadcasterAbbreviation,nationalBroadcasters_broadcasterDescription,nationalBroadcasters_tapeDelayComments,nationalBroadcasters_broadcasterVideoLink,nationalBroadcasters_broadcasterTeamId,nationalBroadcasters_broadcasterRanking,nationalRadioBroadcasters_0_broadcasterScope,nationalRadioBroadcasters_0_broadcasterMedia,nationalRadioBroadcasters_0_broadcasterId,nationalRadioBroadcasters_0_broadcasterDisplay,nationalRadioBroadcasters_0_broadcasterAbbreviation,nationalRadioBroadcasters_0_broadcasterDescription,nationalRadioBroadcasters_0_tapeDelayComments,nationalRadioBroadcasters_0_broadcasterVideoLink,nationalRadioBroadcasters_0_broadcasterTeamId,nationalRadioBroadcasters_0_broadcasterRanking,nationalRadioBroadcasters_1_broadcasterScope,nationalRadioBroadcasters_1_broadcasterMedia,nationalRadioBroadcasters_1_broadcasterId,nationalRadioBroadcasters_1_broadcasterDisplay,nationalRadioBroadcasters_1_broadcasterAbbreviation,nationalRadioBroadcasters_1_broadcasterDescription,nationalRadioBroadcasters_1_tapeDelayComments,nationalRadioBroadcasters_1_broadcasterVideoLink,nationalRadioBroadcasters_1_broadcasterTeamId,nationalRadioBroadcasters_1_broadcasterRanking,homeTvBroadcasters_broadcasterScope,homeTvBroadcasters_broadcasterMedia,homeTvBroadcasters_broadcasterId,homeTvBroadcasters_broadcasterDisplay,homeTvBroadcasters_broadcasterAbbreviation,homeTvBroadcasters_broadcasterDescription,homeTvBroadcasters_tapeDelayComments,homeTvBroadcasters_broadcasterVideoLink,homeTvBroadcasters_broadcasterTeamId,homeTvBroadcasters_broadcasterRanking,homeRadioBroadcasters_broadcasterScope,homeRadioBroadcasters_broadcasterMedia,homeRadioBroadcasters_broadcasterId,homeRadioBroadcasters_broadcasterDisplay,homeRadioBroadcasters_broadcasterAbbreviation,homeRadioBroadcasters_broadcasterDescription,homeRadioBroadcasters_tapeDelayComments,homeRadioBroadcasters_broadcasterVideoLink,homeRadioBroadcasters_broadcasterTeamId,homeRadioBroadcasters_broadcasterRanking,homeOttBroadcasters_broadcasterScope,homeOttBroadcasters_broadcasterMedia,homeOttBroadcasters_broadcasterId,homeOttBroadcasters_broadcasterDisplay,homeOttBroadcasters_broadcasterAbbreviation,homeOttBroadcasters_broadcasterDescription,homeOttBroadcasters_tapeDelayComments,homeOttBroadcasters_broadcasterVideoLink,homeOttBroadcasters_broadcasterTeamId,homeOttBroadcasters_broadcasterRanking,awayTvBroadcasters_broadcasterScope,awayTvBroadcasters_broadcasterMedia,awayTvBroadcasters_broadcasterId,awayTvBroadcasters_broadcasterDisplay,awayTvBroadcasters_broadcasterAbbreviation,awayTvBroadcasters_broadcasterDescription,awayTvBroadcasters_tapeDelayComments,awayTvBroadcasters_broadcasterVideoLink,awayTvBroadcasters_broadcasterTeamId,awayTvBroadcasters_broadcasterRanking,awayRadioBroadcasters_broadcasterScope,awayRadioBroadcasters_broadcasterMedia,awayRadioBroadcasters_broadcasterId,awayRadioBroadcasters_broadcasterDisplay,awayRadioBroadcasters_broadcasterAbbreviation,awayRadioBroadcasters_broadcasterDescription,awayRadioBroadcasters_tapeDelayComments,awayRadioBroadcasters_broadcasterVideoLink,awayRadioBroadcasters_broadcasterTeamId,awayRadioBroadcasters_broadcasterRanking,awayOttBroadcasters_broadcasterScope,awayOttBroadcasters_broadcasterMedia,awayOttBroadcasters_broadcasterId,awayOttBroadcasters_broadcasterDisplay,awayOttBroadcasters_broadcasterAbbreviation,awayOttBroadcasters_broadcasterDescription,awayOttBroadcasters_tapeDelayComments,awayOttBroadcasters_broadcasterVideoLink,awayOttBroadcasters_broadcasterTeamId,awayOttBroadcasters_broadcasterRanking
00,2024-25,10/04/2024 00:00:00,0012400001,20241004/BOSDEN,3,Final,1,2024-10-04T00:00:00Z,1900-01-01T12:00:00Z,2024-10-04T12:00:00Z,2024-10-04T04:00:00Z,1900-01-01T16:00:00Z,2024-10-04T16:00:00Z,2024-10-04T12:00:00Z,2024-10-04T10:00:00Z,Fri,10,0,,false,,Preseason,NBA Abu Dhabi Game,Neutral Site,Etihad Arena,,Abu Dhabi,N,,Global Games,True,1610612743,Nuggets,Denver,DEN,nuggets,0,1,103,0,1610612738,Celtics,Boston,BOS,celtics,1,0,107,0,1630202,Payton,Pritchard,1610612738,Boston,Celtics,BOS,21.0,,,,,,,,,,,,,,,,,,,,,,,,,natl,tv,7.0,NBA TV,NBA TV,,,,-1.0,0.0,,,,,,,,,,,,,,,,,,,,,,,,,,,,,,,home,radio,1591.0,Altitude Sports Radio 950 AM,KKSE-AM,,,,1610612743.0,0.0,,,,,,,,,,,away,tv,1658.0,NBC SPORTS BOSTON,NBCSB,,,,1610612738.0,0.0,,,,,,,,,,,,,,,,,,,,
00,2024-25,10/04/2024 00:00:00,0012400002,20241004/NZBUTA,3,Final,2,2024-10-04T00:00:00Z,1900-01-01T21:00:00Z,2024-10-04T21:00:00Z,2024-10-04T04:00:00Z,1900-01-01T01:00:00Z,2024-10-05T01:00:00Z,2024-10-05T14:00:00Z,2024-10-04T19:00:00Z,Fri,10,0,,false,,Preseason,,,Delta Center,UT,Salt Lake City,N,,,False,1610612762,Jazz,Utah,UTA,jazz,1,0,116,0,15020,Breakers,New Zealand,NZB,breakers,0,1,87,0,1630548,Johnny,Juzang,1610612762,Utah,Jazz,UTA,19.0,,,,,,,,,,,,,,,,,,,,,,,,,,,,,,,,,,,,,,,,,,,,,,,,,,,,,,,home,tv,122.0,KJZZ,KJZZ,,,,1610612762.0,0.0,home,radio,1001084.0,KSL 97.5 FM / S: KBMG 106.3 FM,KSL-FM/KBMG,,,,1610612762.0,0.0,,,,,,,,,,,,,,,,,,,,,,,,,,,,,,,,,,,,,,,,
00,2024-25,10/04/2024 00:00:00,0012400003,20241004/MINLAL,3,Final,3,2024-10-04T00:00:00Z,1900-01-01T22:30:00Z,2024-10-04T22:30:00Z,2024-10-04T04:00:00Z,1900-01-01T02:30:00Z,2024-10-05T02:30:00Z,2024-10-04T21:30:00Z,2024-10-04T19:30:00Z,Fri,10,0,,false,,Preseason,,,Acrisure Arena,CA,Palm Desert,N,,,False,1610612747,Lakers,Los Angeles,LAL,lakers,0,1,107,0,1610612750,Timberwolves,Minnesota,MIN,timberwolves,1,0,124,0,1631169,Josh,Minott,1610612750,Minnesota,Timberwolves,MIN,22.0,,,,,,,,,,,,,,,,,,,,,,,,,natl,tv,7.0,NBA TV,NBA TV,,,,-1.0,0.0,,,,,,,,,,,,,,,,,,,,,home,tv,1651.0,Spectrum SportsNet,SPECSN,,,,1610612747.0,0.0,home,radio,1000286.0,ESPN LA 710/1330 KWKW,KSPN/KWKW-LAL,,,,1610612747.0,0.0,home,ott,1001037.0,Spectrum SportsNet+,DTC-LAL,,,,1610612747.0,0.0,,,,,,,,,,,away,radio,1001054.0,Wolves App / iHeart Radio,MIN App,,,,1610612750.0,0.0,,,,,,,,,,
00,2024-25,10/05/2024 00:00:00,0012400004,20241005/GSWLAC,3,Final,1,2024-10-05T00:00:00Z,1900-01-01T19:00:00Z,2024-10-05T19:00:00Z,2024-10-05T04:00:00Z,1900-01-01T23:00:00Z,2024-10-05T23:00:00Z,2024-10-05T16:00:00Z,2024-10-05T16:00:00Z,Sat,10,0,,false,,Preseason,,,Stan Sheriff Center,HI,Honolulu,N,,,False,1610612746,Clippers,LA,LAC,clippers,0,1,90,0,1610612744,Warriors,Golden State,GSW,warriors,1,0,91,0,1630322,Lindy,Waters III,1610612744,Golden State,Warriors,GSW,15.0,,,,,,,,,,,,,,,,,,,,,,,,,natl,tv,7.0,NBA TV,NBA TV,,,,-1.0,0.0,,,,,,,,,,,,,,,,,,,,,home,tv,172.0,KTLA,KTLA,,,,1610612746.0,0.0,,,,,,,,,,,home,ott,1001036.0,ClipperVision,DTC-LAC,,,,1610612746.0,0.0,away,tv,1097.0,NBCSBA,NBCSBA,,,http://stream.nbcsports.com/rsn/nba-warriors-live-stream,1610612744.0,0.0,away,radio,1597.0,95.7 The Game,KGMZ-FM,,,,1610612744.0,0.0,,,,,,,,,,
00,2024-25,10/06/2024 00:00:00,0012400005,20241006/DENBOS,3,Final,1,2024-10-06T00:00:00Z,1900-01-01T10:00:00Z,2024-10-06T10:00:00Z,2024-10-06T04:00:00Z,1900-01-01T14:00:00Z,2024-10-06T14:00:00Z,2024-10-06T08:00:00Z,2024-10-06T10:00:00Z,Sun,10,0,,false,,Preseason,NBA Abu Dhabi Game,Neutral Site,Etihad Arena,,Abu Dhabi,N,,Global Games,True,1610612738,Celtics,Boston,BOS,celtics,2,0,130,0,1610612743,Nuggets,Denver,DEN,nuggets,0,2,104,0,1627759,Jaylen,Brown,1610612738,Boston,Celtics,BOS,21.0,,,,,,,,,,,,,,,,,,,,,,,,,natl,tv,7.0,NBA TV,NBA TV,,,,-1.0,0.0,,,,,,,,,,,,,,,,,,,,,home,tv,1658.0,NBC SPORTS BOSTON,NBCSB,,,,1610612738.0,0.0,,,,,,,,,,,,,,,,,,,,,,,,,,,,,,,away,radio,1730.0,Altitude Sports Radio 92.5 FM,KKSE-FM,,,,1610612743.0,0.0,,,,,,,,,,
00,2024-25,10/06/2024 00:00:00,0012400006,20241006/NYKCHA,3,Final,2,2024-10-06T00:00:00Z,1900-01-01T17:00:00Z,2024-10-06T17:00:00Z,2024-10-06T04:00:00Z,1900-01-01T21:00:00Z,2024-10-06T21:00:00Z,2024-10-06T17:00:00Z,2024-10-06T17:00:00Z,Sun,10,0,,false,,Preseason,,,Spectrum Center,NC,Charlotte,N,,,False,1610612766,Hornets,Charlotte,CHA,hornets,0,1,109,0,1610612752,Knicks,New York,NYK,knicks,1,0,111,0,1630540,Miles,McBride,1610612752,New York,Knicks,NYK,22.0,,,,,,,,,,,,,,,,,,,,,,,,,natl,tv,7.0,NBA TV,NBA TV,,,,-1.0,0.0,,,,,,,,,,,,,,,,,,,,,home,tv,1000357.0,Bally Sports SE-CHA,BSSE-CHA,,,,1610612766.0,0.0,home,radio,1000862.0,WFNZ 92.7 FM,WFNZ-FM,,,,1610612766.0,0.0,,,,,,,,,,,away,tv,100.0,MSG,MSG,,,,1610612752.0,0.0,,,,,,,,,,,,,,,,,,,,
00,2024-25,10/06/2024 00:00:00,0012400007,20241006/WASTOR,3,Final,3,2024-10-06T00:00:00Z,1900-01-01T19:30:00Z,2024-10-06T19:30:00Z,2024-10-06T04:00:00Z,1900-01-01T23:30:00Z,2024-10-06T23:30:00Z,2024-10-06T19:30:00Z,2024-10-06T19:30:00Z,Sun,10,0,,false,,Preseason,NBA Montreal Game,Neutral Site,Bell Centre,QC,Montreal,N,,Global Games,True,1610612761,Raptors,Toronto,TOR,raptors,1,0,125,0,1610612764,Wizards,Washington,WAS,wizards,0,1,98,0,1629628,RJ,Barrett,1610612761,Toronto,Raptors,TOR,17.0,,,,,,,,,,,,,,,,,,,,,,,,,,,,,,,,,,,,,,,,,,,,,,,,,,,,,,,home,tv,11.0,TSN,TSN,,,,1610612761.0,0.0,,,,,,,,,,,,,,,,,,,,,away,tv,1001046.0,Monumental Sports Network,MNMT,,,,1610612764.0,0.0,away,radio,1001049.0,The Team 980 AM / WFED 1500 AM,WTEM/WFED,,,,1610612764.0,0.0,,,,,,,,,,
00,2024-25,10/06/2024 00:00:00,0012400008,20241006/MILDET,3,Final,4,2024-10-06T00:00:00Z,1900-01-01T20:00:00Z,2024-10-06T20:00:00Z,2024-10-06T04:00:00Z,1900-01-01T00:00:00Z,2024-10-07T00:00:00Z,2024-10-06T19:00:00Z,2024-10-06T20:00:00Z,Sun,10,0,,false,,Preseason,,,Little Caesars Arena,MI,Detroit,N,,,False,1610612765,Pistons,Detroit,DET,pistons,1,0,120,0,1610612749,Bucks,Milwaukee,MIL,bucks,0,1,87,0,1631093,Jaden,Ivey,1610612765,Detroit,Pistons,DET,22.0,,,,,,,,,,,,,,,,,,,,,,,,,natl,tv,2.0,ESPN,ESPN,,,https://www.espn.com/espnplus/player/_/id/a8509a26-0878-488c-a842-d8e633e43c7d?ex_cid=nba,-1.0,3.0,,,,,,,,,,,,,,,,,,,,,home,tv,1000339.0,Bally Sports DET,BSDET,,,,1610612765.0,0.0,home,radio,1188.0,97.1 FM The Ticket,WXYT,,,,1610612765.0,0.0,,,,,,,,,,,,,,,,,,,,,away,radio,1697.0,620 AM/103.3 FM WTMJ,WTMJ-AM/FM,,,,1610612749.0,0.0,,,,,,,,,,
00,2024-25,10/06/2024 00:00:00,0012400009,20241006/PHXLAL,3,Final,5,2024-10-06T00:00:00Z,1900-01-01T21:30:00Z,2024-10-06T21:30:00Z,2024-10-06T04:00:00Z,1900-01-01T01:30:00Z,2024-10-07T01:30:00Z,2024-10-06T18:30:00Z,2024-10-06T18:30:00Z,Sun,10,0,,false,,Preseason,,,Acrisure Arena,CA,Palm Desert,N,,,False,1610612747,Lakers,Los Angeles,LAL,lakers,0,2,114,0,1610612756,Suns,Phoenix,PHX,suns,1,0,118,0,2544,LeBron,James,1610612747,Los Angeles,Lakers,LAL,19.0,,,,,,,,,,,,,,,,,,,,,,,,,,,,,,,,,,,,,,,,,,,,,,,,,,,,,,,home,tv,1651.0,Spectrum SportsNet,SPECSN,,,,1610612747.0,0.0,home,radio,1000286.0,ESPN LA 710/1330 KWKW,KSPN/KWKW-LAL,,,,1610612747.0,0.0,home,ott,1001037.0,Spectrum SportsNet+,DTC-LAL,,,,1610612747.0,0.0,away,tv,1000998.0,Arizona's Family 3TV / Arizona's Family Sports,KTVK/KPHE,,,,1610612756.0,0.0,away,radio,1000271.0,ESPN 620 / S: KSUN,KTAR/KSUN,,,,1610612756.0,0.0,away,ott,1001033.0,Suns Live,DTC-PHX,,,,1610612756.0,0.0
00,2024-25,10/07/2024 00:00:00,0012400010,20241007/ORLNOP,3,Final,1,2024-10-07T00:00:00Z,1900-01-01T13:30:00Z,2024-10-07T13:30:00Z,2024-10-07T04:00:00Z,1900-01-01T17:30:00Z,2024-10-07T17:30:00Z,2024-10-07T13:30:00Z,2024-10-07T12:30:00Z,Mon,10,0,,false,,Preseason,,,Smoothie King Center,LA,New Orleans,N,,,False,1610612740,Pelicans,New Orleans,NOP,pelicans,1,0,106,0,1610612753,Magic,Orlando,ORL,magic,0,1,104,0,1641722,Jordan,Hawkins,1610612740,New Orleans,Pelicans,NOP,18.0,,,,,,,,,,,,,,,,,,,,,,,,,,,,,,,,,,,,,,,,,,,,,,,,,,,,,,,home,tv,1000212.0,Pelicans.com,Pelicans.com,,,,1610612740.0,0.0,home,radio,1001198.0,WWL 870 AM,WWL-AM,,,,1610612740.0,0.0,,,,,,,,,,,,,,,,,,,,,away,radio,1000273.0,WYGM 96.9 FM / 740AM,WYGM-FM/AM,,,,1610612753.0,0.0,,,,,,,,,,
00,2024-25,10/07/2024 00:00:00,0012400011,20241007/NZBPHI,3,Final,2,2024-10-07T00:00:00Z,1900-01-01T19:00:00Z,2024-10-07T19:00:00Z,2024-10-07T04:00:00Z,1900-01-01T23:00:00Z,2024-10-07T23:00:00Z,2024-10-08T12:00:00Z,2024-10-07T19:00:00Z,Mon,10,0,,false,,Preseason,,,Wells Fargo Center,PA,Philadelphia,N,,,False,1610612755,76ers,Philadelphia,PHI,sixers,1,0,139,0,15020,Breakers,New Zealand,NZB,breakers,0,2,84,0,196295058,Parker,Jackson-Cartwright,15020,New Zealand,Breakers,NZB,26.0,,,,,,,,,,,,,,,,,,,,,,,,,,,,,,,,,,,,,,,,,,,,,,,,,,,,,,,home,tv,133.0,NBC Sports Philadelphia,NBCSP,,,,1610612755.0,0.0,home,radio,1434.0,97.5 The Fanatic,WPEN,,,,1610612755.0,0.0,,,,,,,,,,,,,,,,,,,,,,,,,,,,,,,,,,,,,,,,
00,2024-25,10/07/2024 00:00:00,0012400012,20241007/MEMDAL,3,Final,3,2024-10-07T00:00:00Z,1900-01-01T20:00:00Z,2024-10-07T20:00:00Z,2024-10-07T04:00:00Z,1900-01-01T00:00:00Z,2024-10-08T00:00:00Z,2024-10-07T19:00:00Z,2024-10-07T19:00:00Z,Mon,10,0,,false,,Preseason,,,American Airlines Center,TX,Dallas,N,,,False,1610612742,Mavericks,Dallas,DAL,mavericks,0,1,116,0,1610612763,Grizzlies,Memphis,MEM,grizzlies,1,0,121,0,1630702,Jaden,Hardy,1610612742,Dallas,Mavericks,DAL,21.0,,,,,,,,,,,,,,,,,,,,,,,,,,,,,,,,,,,,,,,,,,,,,,,,,,,,,,,home,tv,1000218.0,Mavs.com,Mavs.com,,,,1610612742.0,0.0,home,radio,1000695.0,97.1 FM / S: 99.1 FM,KEGL/KFZO,,,,1610612742.0,0.0,,,,,,,,,,,,,,,,,,,,,away,radio,1000152.0,ESPN 92.9FM/680AM,WMFS,,,,1610612763.0,0.0,,,,,,,,,,
00,2024-25,10/07/2024 00:00:00,0012400013,20241007/OKCSAS,3,Final,4,2024-10-07T00:00:00Z,1900-01-01T20:00:00Z,2024-10-07T20:00:00Z,2024-10-07T04:00:00Z,1900-01-01T00:00:00Z,2024-10-08T00:00:00Z,2024-10-07T19:00:00Z,2024-10-07T19:00:00Z,Mon,10,0,,false,,Preseason,,,Frost Bank Center,TX,San Antonio,N,,,False,1610612759,Spurs,San Antonio,SAS,spurs,0,1,107,0,1610612760,Thunder,Oklahoma City,OKC,thunder,1,0,112,0,1630577,Julian,Champagnie,1610612759,San Antonio,Spurs,SAS,22.0,,,,,,,,,,,,,,,,,,,,,,,,,natl,tv,7.0,NBA TV,NBA TV,,,,-1.0,0.0,,,,,,,,,,,,,,,,,,,,,home,tv,1000696.0,CW35,CW35,,,,1610612759.0,0.0,home,radio,1000260.0,WOAI/KXTN,WOAI/KXTN,,,,1610612759.0,0.0,,,,,,,,,,,away,tv,1000345.0,Bally Sports OK,BSOK,,,,1610612760.0,0.0,away,radio,1140.0,WWLS 98.1FM OKC,WWLS,,,,1610612760.0,0.0,,,,,,,,,,
00,2024-25,10/07/2024 00:00:00,0012400014,20241007/HOUUTA,3,Final,5,2024-10-07T00:00:00Z,1900-01-01T21:00:00Z,2024-10-07T21:00:00Z,2024-10-07T04:00:00Z,1900-01-01T01:00:00Z,2024-10-08T01:00:00Z,2024-10-07T20:00:00Z,2024-10-07T19:00:00Z,Mon,10,0,,false,,Preseason,,,Delta Center,UT,Salt Lake City,N,,,False,1610612762,Jazz,Utah,UTA,jazz,2,0,122,0,1610612745,Rockets,Houston,HOU,rockets,0,1,113,0,1630224,Jalen,Green,1610612745,Houston,Rockets,HOU,21.0,,,,,,,,,,,,,,,,,,,,,,,,,,,,,,,,,,,,,,,,,,,,,,,,,,,,,,,home,tv,122.0,KJZZ,KJZZ,,,,1610612762.0,0.0,home,radio,1001084.0,KSL 97.5 FM / S: KBMG 106.3 FM,KSL-FM/KBMG,,,,1610612762.0,0.0,,,,,,,,,,,away,tv,1001056.0,Space City Home Network,SCHN,,,,1610612745.0,0.0,away,radio,1000699.0,790 AM / S: 93.3 FM,KBME/KQBU-FM,,,,1610612745.0,0.0,,,,,,,,,,
00,2024-25,10/08/2024 00:00:00,0012400015,20241008/MIACHA,3,Final,1,2024-10-08T00:00:00Z,1900-01-01T19:00:00Z,2024-10-08T19:00:00Z,2024-10-08T04:00:00Z,1900-01-01T23:00:00Z,2024-10-08T23:00:00Z,2024-10-08T19:00:00Z,2024-10-08T19:00:00Z,Tue,10,0,,false,,Preseason,,,Spectrum Center,NC,Charlotte,N,,,False,1610612766,Hornets,Charlotte,CHA,hornets,1,1,111,0,1610612748,Heat,Miami,MIA,heat,0,1,108,0,1630163,LaMelo,Ball,1610612766,Charlotte,Hornets,CHA,24.0,,,,,,,,,,,,,,,,,,,,,,,,,,,,,,,,,,,,,,,,,,,,,,,,,,,,,,,home,tv,1000357.0,Bally Sports SE-CHA,BSSE-CHA,,,,1610612766.0,0.0,home,radio,1000862.0,WFNZ 92.7 FM,WFNZ-FM,,,,1610612766.0,0.0,,,,,,,,,,,away,tv,1000354.0,Bally Sports Sun,BSSUN,,,,1610612748.0,0.0,away,radio,1000832.0,WQAM 560,WQAM,,,,1610612748.0,0.0,,,,,,,,,,
00,2024-25,10/08/2024 00:00:00,0012400016,20241008/CHICLE,3,Final,2,2024-10-08T00:00:00Z,1900-01-01T19:00:00Z,2024-10-08T19:00:00Z,2024-10-08T04:00:00Z,1900-01-01T23:00:00Z,2024-10-08T23:00:00Z,2024-10-08T18:00:00Z,2024-10-08T19:00:00Z,Tue,10,0,,false,,Preseason,,,Rocket Mortgage FieldHouse,OH,Cleveland,N,,,False,1610612739,Cavaliers,Cleveland,CLE,cavaliers,0,1,112,0,1610612741,Bulls,Chicago,CHI,bulls,1,0,116,0,1629632,Coby,White,1610612741,Chicago,Bulls,CHI,21.0,,,,,,,,,,,,,,,,,,,,,,,,,,,,,,,,,,,,,,,,,,,,,,,,,,,,,,,home,tv,1000358.0,Bally Sports Ohio,BSOH,,,,1610612739.0,0.0,home,radio,1040.0,WTAM/WMMS,WTAM/WMMS,,,,1610612739.0,0.0,,,,,,,,,,,away,tv,1001208.0,Chicago Sports Network,CHSN,,,,1610612741.0,0.0,away,radio,1687.0,670 The Score,WSCR,,,,1610612741.0,0.0,,,,,,,,,,
00,2024-25,10/08/2024 00:00:00,0012400017,20241008/PHXDET,3,Final,3,2024-10-08T00:00:00Z,1900-01-01T19:00:00Z,2024-10-08T19:00:00Z,2024-10-08T04:00:00Z,1900-01-01T23:00:00Z,2024-10-08T23:00:00Z,2024-10-08T16:00:00Z,2024-10-08T19:00:00Z,Tue,10,0,,false,,Preseason,,,Breslin Center,MI,East Lansing,N,,,False,1610612765,Pistons,Detroit,DET,pistons,1,1,97,0,1610612756,Suns,Phoenix,PHX,suns,2,0,105,0,201142,Kevin,Durant,1610612756,Phoenix,Suns,PHX,21.0,,,,,,,,,,,,,,,,,,,,,,,,,,,,,,,,,,,,,,,,,,,,,,,,,,,,,,,home,tv,1000339.0,Bally Sports DET,BSDET,,,,1610612765.0,0.0,home,radio,1188.0,97.1 FM The Ticket,WXYT,,,,1610612765.0,0.0,,,,,,,,,,,away,tv,1000998.0,Arizona's Family 3TV / Arizona's Family Sports,KTVK/KPHE,,,,1610612756.0,0.0,away,radio,1000271.0,ESPN 620 / S: KSUN,KTAR/KSUN,,,,1610612756.0,0.0,away,ott,1001033.0,Suns Live,DTC-PHX,,,,1610612756.0,0.0
00,2024-25,10/08/2024 00:00:00,0012400018,20241008/INDATL,3,Final,4,2024-10-08T00:00:00Z,1900-01-01T19:30:00Z,2024-10-08T19:30:00Z,2024-10-08T04:00:00Z,1900-01-01T23:30:00Z,2024-10-08T23:30:00Z,2024-10-08T19:30:00Z,2024-10-08T19:30:00Z,Tue,10,0,,false,,Preseason,,,State Farm Arena,GA,Atlanta,N,,,False,1610612737,Hawks,Atlanta,ATL,hawks,1,0,131,0,1610612754,Pacers,Indiana,IND,pacers,0,1,130,0,1630552,Jalen,Johnson,1610612737,Atlanta,Hawks,ATL,19.0,,,,,,,,,,,,,,,,,,,,,,,,,natl,tv,7.0,NBA TV,NBA TV,,,,-1.0,0.0,,,,,,,,,,,,,,,,,,,,,home,tv,1000356.0,Bally Sports SE-ATL,BSSE-ATL,,,,1610612737.0,0.0,home,radio,1491.0,WZGC,WZGC,,,,1610612737.0,0.0,,,,,,,,,,,,,,,,,,,,,away,radio,1641.0,93.5/107.5 The Fan,WFNI-FM/AM,,,,1610612754.0,0.0,,,,,,,,,,
00,2024-25,10/08/2024 00:00:00,0012400019,20241008/BKNLAC,3,Final,5,2024-10-08T00:00:00Z,1900-01-01T22:30:00Z,2024-10-08T22:30:00Z,2024-10-08T04:00:00Z,1900-01-01T02:30:00Z,2024-10-09T02:30:00Z,2024-10-08T22:30:00Z,2024-10-08T19:30:00Z,Tue,10,0,,false,,Preseason,,,Frontwave Arena,CA,Oceanside,N,,,False,1610612746,Clippers,LA,LAC,clippers,1,1,115,0,1610612751,Nets,Brooklyn,BKN,nets,0,1,106,0,1630553,Keon,Johnson,1610612751,Brooklyn,Nets,BKN,14.0,201935.0,James,Harden,1610612746.0,LA,Clippers,LAC,14.0,,,,,,,,,,,,,,,,,,,,,,,,,,,,,,,,,,,,,,,,,,,,,,,,,,,,,,,,,,,,,,,,,,,home,ott,1001036.0,ClipperVision,DTC-LAC,,,,1610612746.0,0.0,,,,,,,,,,,,,,,,,,,,,,,,,,,,,,
00,2024-25,10/09/2024 00:00:00,0012400020,20241009/WASNYK,3,Final,1,2024-10-09T00:00:00Z,1900-01-01T19:30:00Z,2024-10-09T19:30:00Z,2024-10-09T04:00:00Z,1900-01-01T23:30:00Z,2024-10-09T23:30:00Z,2024-10-09T19:30:00Z,2024-10-09T19:30:00Z,Wed,10,0,,false,,Preseason,,,Madison Square Garden,NY,New York,N,,,False,1610612752,Knicks,New York,NYK,knicks,2,0,117,0,1610612764,Wizards,Washington,WAS,wizards,0,2,94,0,1626157,Karl-Anthony,Towns,1610612752,New York,Knicks,NYK,25.0,,,,,,,,,,,,,,,,,,,,,,,,,,,,,,,,,,,,,,,,,,,,,,,,,,,,,,,home,tv,100.0,MSG,MSG,,,,1610612752.0,0.0,,,,,,,,,,,,,,,,,,,,,away,tv,1001046.0,Monumental Sports Network,MNMT,,,,1610612764.0,0.0,away,radio,1001049.0,The Team 980 AM / WFED 1500 AM,WTEM/WFED,,,,1610612764.0,0.0,,,,,,,,,,
00,2024-25,10/09/2024 00:00:00,0012400021,20241009/HOUOKC,3,Final/OT,2,2024-10-09T00:00:00Z,1900-01-01T20:00:00Z,2024-10-09T20:00:00Z,2024-10-09T04:00:00Z,1900-01-01T00:00:00Z,2024-10-10T00:00:00Z,2024-10-09T19:00:00Z,2024-10-09T19:00:00Z,Wed,10,0,,false,,Preseason,,,Paycom Center,OK,Oklahoma City,N,,,False,1610612760,Thunder,Oklahoma City,OKC,thunder,1,1,113,0,1610612745,Rockets,Houston,HOU,rockets,1,1,122,0,1630578,Alperen,Sengun,1610612745,Houston,Rockets,HOU,17.0,,,,,,,,,,,,,,,,,,,,,,,,,natl,tv,7.0,NBA TV,NBA TV,,,,-1.0,0.0,,,,,,,,,,,,,,,,,,,,,home,tv,1000345.0,Bally Sports OK,BSOK,,,,1610612760.0,0.0,home,radio,1574.0,WWLS/WKY,WWLS/WKY,,,,1610612760.0,0.0,,,,,,,,,,,away,tv,1001056.0,Space City Home Network,SCHN,,,,1610612745.0,0.0,away,radio,1000699.0,790 AM / S: 93.3 FM,KBME/KQBU-FM,,,,1610612745.0,0.0,,,,,,,,,,
00,2024-25,10/09/2024 00:00:00,0012400022,20241009/ORLSAS,3,Final,3,2024-10-09T00:00:00Z,1900-01-01T20:00:00Z,2024-10-09T20:00:00Z,2024-10-09T04:00:00Z,1900-01-01T00:00:00Z,2024-10-10T00:00:00Z,2024-10-09T20:00:00Z,2024-10-09T19:00:00Z,Wed,10,0,,false,,Preseason,,,Frost Bank Center,TX,San Antonio,N,,,False,1610612759,Spurs,San Antonio,SAS,spurs,1,1,107,0,1610612753,Magic,Orlando,ORL,magic,0,2,97,0,1641724,Jett,Howard,1610612753,Orlando,Magic,ORL,19.0,,,,,,,,,,,,,,,,,,,,,,,,,,,,,,,,,,,,,,,,,,,,,,,,,,,,,,,home,tv,1000696.0,CW35,CW35,,,,1610612759.0,0.0,home,radio,1000260.0,WOAI/KXTN,WOAI/KXTN,,,,1610612759.0,0.0,,,,,,,,,,,,,,,,,,,,,,,,,,,,,,,,,,,,,,,,
00,2024-25,10/09/2024 00:00:00,0012400023,20241009/GSWSAC,3,Final,4,2024-10-09T00:00:00Z,1900-01-01T22:30:00Z,2024-10-09T22:30:00Z,2024-10-09T04:00:00Z,1900-01-01T02:30:00Z,2024-10-10T02:30:00Z,2024-10-09T19:30:00Z,2024-10-09T19:30:00Z,Wed,10,0,,false,,Preseason,,,Golden 1 Center,CA,Sacramento,N,,,False,1610612758,Kings,Sacramento,SAC,kings,0,1,112,0,1610612744,Warriors,Golden State,GSW,warriors,2,0,122,0,1627741,Buddy,Hield,1610612744,Golden State,Warriors,GSW,22.0,,,,,,,,,,,,,,,,,,,,,,,,,natl,tv,2.0,ESPN,ESPN,,,https://www.espn.com/espnplus/player/_/id/747bef88-5dce-455b-83bc-95c34ba71b1c?ex_cid=nba,-1.0,3.0,,,,,,,,,,,,,,,,,,,,,home,tv,1027.0,NBCSCA,NBCSCA,,,http://stream.nbcsports.com/rsn/nba-kings-live-stream,1610612758.0,0.0,home,radio,1052.0,Sactown Sports 1140 AM,KHTK,,,,1610612758.0,0.0,,,,,,,,,,,,,,,,,,,,,away,radio,1597.0,95.7 The Game,KGMZ-FM,,,,1610612744.0,0.0,,,,,,,,,,
00,2024-25,10/10/2024 00:00:00,0012400024,20241010/INDCLE,3,Final,1,2024-10-10T00:00:00Z,1900-01-01T19:00:00Z,2024-10-10T19:00:00Z,2024-10-10T04:00:00Z,1900-01-01T23:00:00Z,2024-10-10T23:00:00Z,2024-10-10T19:00:00Z,2024-10-10T19:00:00Z,Thu,10,0,,false,,Preseason,,,Rocket Mortgage FieldHouse,OH,Cleveland,N,,,False,1610612739,Cavaliers,Cleveland,CLE,cavaliers,0,2,117,0,1610612754,Pacers,Indiana,IND,pacers,1,1,129,0,1631097,Bennedict,Mathurin,1610612754,Indiana,Pacers,IND,25.0,,,,,,,,,,,,,,,,,,,,,,,,,,,,,,,,,,,,,,,,,,,,,,,,,,,,,,,home,tv,1000358.0,Bally Sports Ohio,BSOH,,,,1610612739.0,0.0,home,radio,1181.0,100.7 WMMS,WMMS,,,,1610612739.0,0.0,,,,,,,,,,,,,,,,,,,,,away,radio,1641.0,93.5/107.5 The Fan,WFNI-FM/AM,,,,1610612754.0,0.0,,,,,,,,,,
00,2024-25,10/10/2024 00:00:00,0012400026,20241010/UTADAL,3,Final,2,2024-10-10T00:00:00Z,1900-01-01T20:00:00Z,2024-10-10T20:00:00Z,2024-10-10T04:00:00Z,1900-01-01T00:00:00Z,2024-10-11T00:00:00Z,2024-10-10T18:00:00Z,2024-10-10T19:00:00Z,Thu,10,0,,false,,Preseason,,,American Airlines Center,TX,Dallas,N,,,False,1610612742,Mavericks,Dallas,DAL,mavericks,0,2,102,0,1610612762,Jazz,Utah,UTA,jazz,3,0,107,0,1628374,Lauri,Markkanen,1610612762,Utah,Jazz,UTA,26.0,,,,,,,,,,,,,,,,,,,,,,,,,,,,,,,,,,,,,,,,,,,,,,,,,,,,,,,,,,,,,,,,,home,radio,1000695.0,97.1 FM / S: 99.1 FM,KEGL/KFZO,,,,1610612742.0,0.0,,,,,,,,,,,away,tv,122.0,KJZZ,KJZZ,,,,1610612762.0,0.0,away,radio,1001084.0,KSL 97.5 FM / S: KBMG 106.3 FM,KSL-FM/KBMG,,,,1610612762.0,0.0,,,,,,,,,,
00,2024-25,10/10/2024 00:00:00,0012400027,20241010/CHAMEM,3,Final,3,2024-10-10T00:00:00Z,1900-01-01T20:00:00Z,2024-10-10T20:00:00Z,2024-10-10T04:00:00Z,1900-01-01T00:00:00Z,2024-10-11T00:00:00Z,2024-10-10T20:00:00Z,2024-10-10T19:00:00Z,Thu,10,0,,false,,Preseason,,,FedExForum,TN,Memphis,N,,,False,1610612763,Grizzlies,Memphis,MEM,grizzlies,1,1,94,0,1610612766,Hornets,Charlotte,CHA,hornets,2,1,119,0,1641706,Brandon,Miller,1610612766,Charlotte,Hornets,CHA,22.0,,,,,,,,,,,,,,,,,,,,,,,,,,,,,,,,,,,,,,,,,,,,,,,,,,,,,,,home,tv,1000355.0,Bally Sports SE-MEM,BSSE-MEM,,,,1610612763.0,0.0,home,radio,1000152.0,ESPN 92.9FM/680AM,WMFS,,,,1610612763.0,0.0,,,,,,,,,,,away,tv,1000357.0,Bally Sports SE-CHA,BSSE-CHA,,,,1610612766.0,0.0,away,radio,1000862.0,WFNZ 92.7 FM,WFNZ-FM,,,,1610612766.0,0.0,,,,,,,,,,
00,2024-25,10/10/2024 00:00:00,0012400028,20241010/LALMIL,3,Final,4,2024-10-10T00:00:00Z,1900-01-01T20:00:00Z,2024-10-10T20:00:00Z,2024-10-10T04:00:00Z,1900-01-01T00:00:00Z,2024-10-11T00:00:00Z,2024-10-10T17:00:00Z,2024-10-10T19:00:00Z,Thu,10,0,,false,,Preseason,,,Fiserv Forum,WI,Milwaukee,N,,,False,1610612749,Bucks,Milwaukee,MIL,bucks,0,2,102,0,1610612747,Lakers,Los Angeles,LAL,lakers,1,2,107,0,1626171,Bobby,Portis,1610612749,Milwaukee,Bucks,MIL,23.0,,,,,,,,,,,,,,,,,,,,,,,,,natl,tv,7.0,NBA TV,NBA TV,,,,-1.0,0.0,,,,,,,,,,,,,,,,,,,,,home,tv,1000351.0,Bally Sports WI,BSWI,,,,1610612749.0,0.0,home,radio,1697.0,620 AM/103.3 FM WTMJ,WTMJ-AM/FM,,,,1610612749.0,0.0,,,,,,,,,,,away,tv,1651.0,Spectrum SportsNet,SPECSN,,,,1610612747.0,0.0,away,radio,1000286.0,ESPN LA 710/1330 KWKW,KSPN/KWKW-LAL,,,,1610612747.0,0.0,away,ott,1001037.0,Spectrum SportsNet+,DTC-LAL,,,,1610612747.0,0.0
00,2024-25,10/10/2024 00:00:00,0012400029,20241010/NZBOKC,3,Final,5,2024-10-10T00:00:00Z,1900-01-01T20:00:00Z,2024-10-10T20:00:00Z,2024-10-10T04:00:00Z,1900-01-01T00:00:00Z,2024-10-11T00:00:00Z,2024-10-11T13:00:00Z,2024-10-10T19:00:00Z,Thu,10,0,,false,,Preseason,,,BOK Center,OK,Tulsa,N,,,False,1610612760,Thunder,Oklahoma City,OKC,thunder,2,1,117,0,15020,Breakers,New Zealand,NZB,breakers,0,3,89,0,1641745,Adam,Flagler,1610612760,Oklahoma City,Thunder,OKC,25.0,,,,,,,,,,,,,,,,,,,,,,,,,,,,,,,,,,,,,,,,,,,,,,,,,,,,,,,home,tv,1000345.0,Bally Sports OK,BSOK,,,,1610612760.0,0.0,home,radio,1140.0,WWLS 98.1FM OKC,WWLS,,,,1610612760.0,0.0,,,,,,,,,,,,,,,,,,,,,,,,,,,,,,,,,,,,,,,,
00,2024-25,10/11/2024 00:00:00,0012400031,20241011/TORWAS,3,Final,2,2024-10-11T00:00:00Z,1900-01-01T19:00:00Z,2024-10-11T19:00:00Z,2024-10-11T04:00:00Z,1900-01-01T23:00:00Z,2024-10-11T23:00:00Z,2024-10-11T19:00:00Z,2024-10-11T19:00:00Z,Fri,10,0,,false,,Preseason,,,Capital One Arena,DC,Washington,N,,,False,1610612764,Wizards,Washington,WAS,wizards,1,2,113,0,1610612761,Raptors,Toronto,TOR,raptors,1,1,95,0,1628449,Chris,Boucher,1610612761,Toronto,Raptors,TOR,22.0,1628398.0,Kyle,Kuzma,1610612764.0,Washington,Wizards,WAS,22.0,,,,,,,,,,,,,,,,,natl,tv,7.0,NBA TV,NBA TV,,,,-1.0,0.0,,,,,,,,,,,,,,,,,,,,,home,tv,1001046.0,Monumental Sports Network,MNMT,,,,1610612764.0,0.0,home,radio,1001049.0,The Team 980 AM / WFED 1500 AM,WTEM/WFED,,,,1610612764.0,0.0,,,,,,,,,,,away,tv,11.0,TSN,TSN,,,,1610612761.0,0.0,,,,,,,,,,,,,,,,,,,,
00,2024-25,10/11/2024 00:00:00,0012400032,20241011/PHIMIN,3,Final,3,2024-10-11T00:00:00Z,1900-01-01T19:00:00Z,2024-10-11T19:00:00Z,2024-10-11T04:00:00Z,1900-01-01T23:00:00Z,2024-10-11T23:00:00Z,2024-10-11T19:00:00Z,2024-10-11T18:00:00Z,Fri,10,0,,false,,Preseason,,,Wells Fargo Arena,IA,Des Moines,N,,,False,1610612750,Timberwolves,Minnesota,MIN,timberwolves,2,0,121,0,1610612755,76ers,Philadelphia,PHI,sixers,1,1,111,0,202331,Paul,George,1610612755,Philadelphia,76ers,PHI,23.0,,,,,,,,,,,,,,,,,,,,,,,,,,,,,,,,,,,,,,,,,,,,,,,,,,,,,,,,,,,,,,,,,home,radio,1001054.0,Wolves App / iHeart Radio,MIN App,,,,1610612750.0,0.0,,,,,,,,,,,,,,,,,,,,,away,radio,1434.0,97.5 The Fanatic,WPEN,,,,1610612755.0,0.0,,,,,,,,,,
00,2024-25,10/11/2024 00:00:00,0012400033,20241011/SACGSW,3,Final,4,2024-10-11T00:00:00Z,1900-01-01T22:00:00Z,2024-10-11T22:00:00Z,2024-10-11T04:00:00Z,1900-01-01T02:00:00Z,2024-10-12T02:00:00Z,2024-10-11T19:00:00Z,2024-10-11T19:00:00Z,Fri,10,0,,false,,Preseason,,,Chase Center,CA,San Francisco,N,,,False,1610612744,Warriors,Golden State,GSW,warriors,3,0,109,0,1610612758,Kings,Sacramento,SAC,kings,0,2,106,0,1630541,Moses,Moody,1610612744,Golden State,Warriors,GSW,23.0,,,,,,,,,,,,,,,,,,,,,,,,,natl,tv,7.0,NBA TV,NBA TV,,,,-1.0,0.0,,,,,,,,,,,,,,,,,,,,,home,tv,1097.0,NBCSBA,NBCSBA,,,http://stream.nbcsports.com/rsn/nba-warriors-live-stream,1610612744.0,0.0,home,radio,1597.0,95.7 The Game,KGMZ-FM,,,,1610612744.0,0.0,,,,,,,,,,,,,,,,,,,,,away,radio,1052.0,Sactown Sports 1140 AM,KHTK,,,,1610612758.0,0.0,,,,,,,,,,
00,2024-25,10/11/2024 00:00:00,0012400034,20241011/DETPHX,3,Final,5,2024-10-11T00:00:00Z,1900-01-01T22:00:00Z,2024-10-11T22:00:00Z,2024-10-11T04:00:00Z,1900-01-01T02:00:00Z,2024-10-12T02:00:00Z,2024-10-11T22:00:00Z,2024-10-11T19:00:00Z,Fri,10,0,,false,,Preseason,,,Footprint Center,AZ,Phoenix,N,,,False,1610612756,Suns,Phoenix,PHX,suns,2,1,91,0,1610612765,Pistons,Detroit,DET,pistons,2,1,109,0,1630595,Cade,Cunningham,1610612765,Detroit,Pistons,DET,25.0,,,,,,,,,,,,,,,,,,,,,,,,,,,,,,,,,,,,,,,,,,,,,,,,,,,,,,,home,tv,1000998.0,Arizona's Family 3TV / Arizona's Family Sports,KTVK/KPHE,,,,1610612756.0,0.0,home,radio,1598.0,KMVP 98.7 / S: KSUN,KMVP/KSUN,,,,1610612756.0,0.0,home,ott,1001033.0,Suns Live,DTC-PHX,,,,1610612756.0,0.0,,,,,,,,,,,away,radio,1188.0,97.1 FM The Ticket,WXYT,,,,1610612765.0,0.0,,,,,,,,,,
00,2024-25,10/11/2024 00:00:00,0012400035,20241011/PORLAC,3,Final,6,2024-10-11T00:00:00Z,1900-01-01T22:30:00Z,2024-10-11T22:30:00Z,2024-10-11T04:00:00Z,1900-01-01T02:30:00Z,2024-10-12T02:30:00Z,2024-10-11T19:30:00Z,2024-10-11T19:30:00Z,Fri,10,0,,false,,Preseason,,,Climate Pledge Arena,WA,Seattle,N,,,False,1610612746,Clippers,LA,LAC,clippers,2,1,101,0,1610612757,Trail Blazers,Portland,POR,blazers,0,1,99,0,1641739,Toumani,Camara,1610612757,Portland,Trail Blazers,POR,19.0,,,,,,,,,,,,,,,,,,,,,,,,,,,,,,,,,,,,,,,,,,,,,,,,,,,,,,,home,tv,172.0,KTLA,KTLA,,,,1610612746.0,0.0,,,,,,,,,,,home,ott,1001036.0,ClipperVision,DTC-LAC,,,,1610612746.0,0.0,,,,,,,,,,,away,radio,1472.0,Rip City Radio 620,KPOJ,,,,1610612757.0,0.0,,,,,,,,,,
00,2024-25,10/12/2024 00:00:00,0012400036,20241012/PHIBOS,3,Final,1,2024-10-12T00:00:00Z,1900-01-01T20:00:00Z,2024-10-12T20:00:00Z,2024-10-12T04:00:00Z,1900-01-01T00:00:00Z,2024-10-13T00:00:00Z,2024-10-12T20:00:00Z,2024-10-12T20:00:00Z,Sat,10,0,,false,,Preseason,,,TD Garden,MA,Boston,N,,,False,1610612738,Celtics,Boston,BOS,celtics,3,0,139,0,1610612755,76ers,Philadelphia,PHI,sixers,1,2,89,0,1642272,Jared,McCain,1610612755,Philadelphia,76ers,PHI,20.0,,,,,,,,,,,,,,,,,,,,,,,,,,,,,,,,,,,,,,,,,,,,,,,,,,,,,,,home,tv,1658.0,NBC SPORTS BOSTON,NBCSB,,,,1610612738.0,0.0,home,radio,1471.0,98.5 The Sports Hub,WBZ-FM,,,,1610612738.0,0.0,,,,,,,,,,,away,tv,1166.0,NBCSP+,NBCSP+,,,,1610612755.0,0.0,away,radio,1434.0,97.5 The Fanatic,WPEN,,,,1610612755.0,0.0,,,,,,,,,,
00,2024-25,10/12/2024 00:00:00,0012400037,20241012/MEMCHI,3,Final,2,2024-10-12T00:00:00Z,1900-01-01T20:00:00Z,2024-10-12T20:00:00Z,2024-10-12T04:00:00Z,1900-01-01T00:00:00Z,2024-10-13T00:00:00Z,2024-10-12T19:00:00Z,2024-10-12T19:00:00Z,Sat,10,0,,false,,Preseason,,,United Center,IL,Chicago,N,,,False,1610612741,Bulls,Chicago,CHI,bulls,1,1,121,0,1610612763,Grizzlies,Memphis,MEM,grizzlies,2,1,124,0,203897,Zach,LaVine,1610612741,Chicago,Bulls,CHI,28.0,,,,,,,,,,,,,,,,,,,,,,,,,,,,,,,,,,,,,,,,,,,,,,,,,,,,,,,home,tv,1001208.0,Chicago Sports Network,CHSN,,,,1610612741.0,0.0,,,,,,,,,,,,,,,,,,,,,,,,,,,,,,,away,radio,1000152.0,ESPN 92.9FM/680AM,WMFS,,,,1610612763.0,0.0,,,,,,,,,,
00,2024-25,10/12/2024 00:00:00,0012400038,20241012/UTASAS,3,Final,3,2024-10-12T00:00:00Z,1900-01-01T20:00:00Z,2024-10-12T20:00:00Z,2024-10-12T04:00:00Z,1900-01-01T00:00:00Z,2024-10-13T00:00:00Z,2024-10-12T18:00:00Z,2024-10-12T19:00:00Z,Sat,10,0,,false,,Preseason,,,Frost Bank Center,TX,San Antonio,N,,,False,1610612759,Spurs,San Antonio,SAS,spurs,2,1,126,0,1610612762,Jazz,Utah,UTA,jazz,3,1,120,0,1629012,Collin,Sexton,1610612762,Utah,Jazz,UTA,24.0,,,,,,,,,,,,,,,,,,,,,,,,,,,,,,,,,,,,,,,,,,,,,,,,,,,,,,,home,tv,1000696.0,CW35,CW35,,,,1610612759.0,0.0,home,radio,1000260.0,WOAI/KXTN,WOAI/KXTN,,,,1610612759.0,0.0,,,,,,,,,,,away,tv,122.0,KJZZ,KJZZ,,,,1610612762.0,0.0,away,radio,1001084.0,KSL 97.5 FM / S: KBMG 106.3 FM,KSL-FM/KBMG,,,,1610612762.0,0.0,,,,,,,,,,
00,2024-25,10/13/2024 00:00:00,0012400039,20241013/NOPMIA,3,Final,1,2024-10-13T00:00:00Z,1900-01-01T15:30:00Z,2024-10-13T15:30:00Z,2024-10-13T04:00:00Z,1900-01-01T19:30:00Z,2024-10-13T19:30:00Z,2024-10-13T14:30:00Z,2024-10-13T15:30:00Z,Sun,10,0,,false,,Preseason,,,Kaseya Center,FL,Miami,N,,,False,1610612748,Heat,Miami,MIA,heat,1,1,101,0,1610612740,Pelicans,New Orleans,NOP,pelicans,1,1,99,0,1629627,Zion,Williamson,1610612740,New Orleans,Pelicans,NOP,13.0,,,,,,,,,,,,,,,,,,,,,,,,,,,,,,,,,,,,,,,,,,,,,,,,,,,,,,,home,tv,1000354.0,Bally Sports Sun,BSSUN,,,,1610612748.0,0.0,home,radio,1000851.0,WQAM 560 / S: WAQI 710,WQAM/WAQI,,,,1610612748.0,0.0,,,,,,,,,,,away,tv,1000212.0,Pelicans.com,Pelicans.com,,,,1610612740.0,0.0,away,radio,1001198.0,WWL 870 AM,WWL-AM,,,,1610612740.0,0.0,,,,,,,,,,
00,2024-25,10/13/2024 00:00:00,0012400040,20241013/MINNYK,3,Final,2,2024-10-13T00:00:00Z,1900-01-01T18:00:00Z,2024-10-13T18:00:00Z,2024-10-13T04:00:00Z,1900-01-01T22:00:00Z,2024-10-13T22:00:00Z,2024-10-13T17:00:00Z,2024-10-13T18:00:00Z,Sun,10,0,,false,,Preseason,,,Madison Square Garden,NY,New York,N,,,False,1610612752,Knicks,New York,NYK,knicks,3,0,115,0,1610612750,Timberwolves,Minnesota,MIN,timberwolves,2,1,110,0,1630162,Anthony,Edwards,1610612750,Minnesota,Timberwolves,MIN,31.0,,,,,,,,,,,,,,,,,,,,,,,,,natl,tv,2.0,ESPN,ESPN,,,https://www.espn.com/espnplus/player/_/id/0a961b28-41d5-4454-9b93-4ce8508ef6b6?ex_cid=nba,-1.0,3.0,,,,,,,,,,,,,,,,,,,,,home,tv,100.0,MSG,MSG,,,,1610612752.0,0.0,,,,,,,,,,,,,,,,,,,,,,,,,,,,,,,away,radio,1001054.0,Wolves App / iHeart Radio,MIN App,,,,1610612750.0,0.0,,,,,,,,,,
00,2024-25,10/13/2024 00:00:00,0012400041,20241013/PORSAC,3,Final,3,2024-10-13T00:00:00Z,1900-01-01T18:00:00Z,2024-10-13T18:00:00Z,2024-10-13T04:00:00Z,1900-01-01T22:00:00Z,2024-10-13T22:00:00Z,2024-10-13T15:00:00Z,2024-10-13T15:00:00Z,Sun,10,0,,false,,Preseason,,,Golden 1 Center,CA,Sacramento,N,,,False,1610612758,Kings,Sacramento,SAC,kings,0,3,85,0,1610612757,Trail Blazers,Portland,POR,blazers,1,1,105,0,1630703,Scoot,Henderson,1610612757,Portland,Trail Blazers,POR,17.0,,,,,,,,,,,,,,,,,,,,,,,,,,,,,,,,,,,,,,,,,,,,,,,,,,,,,,,home,tv,1000214.0,Kings.com/live,Kings.com,,,,1610612758.0,0.0,home,radio,1052.0,Sactown Sports 1140 AM,KHTK,,,,1610612758.0,0.0,,,,,,,,,,,,,,,,,,,,,away,radio,1472.0,Rip City Radio 620,KPOJ,,,,1610612757.0,0.0,away,ott,1001128.0,BlazerVision,DTC-POR,,,,1610612757.0,0.0
00,2024-25,10/13/2024 00:00:00,0012400042,20241013/TORBOS,3,Final,4,2024-10-13T00:00:00Z,1900-01-01T19:00:00Z,2024-10-13T19:00:00Z,2024-10-13T04:00:00Z,1900-01-01T23:00:00Z,2024-10-13T23:00:00Z,2024-10-13T19:00:00Z,2024-10-13T19:00:00Z,Sun,10,0,,false,,Preseason,,,TD Garden,MA,Boston,N,,,False,1610612738,Celtics,Boston,BOS,celtics,4,0,115,0,1610612761,Raptors,Toronto,TOR,raptors,1,2,111,0,1641809,Drew,Peterson,1610612738,Boston,Celtics,BOS,23.0,,,,,,,,,,,,,,,,,,,,,,,,,,,,,,,,,,,,,,,,,,,,,,,,,,,,,,,home,tv,1658.0,NBC SPORTS BOSTON,NBCSB,,,,1610612738.0,0.0,home,radio,1471.0,98.5 The Sports Hub,WBZ-FM,,,,1610612738.0,0.0,,,,,,,,,,,away,tv,1563.0,SN,SN,,,,1610612761.0,0.0,,,,,,,,,,,,,,,,,,,,
00,2024-25,10/13/2024 00:00:00,0012400043,20241013/PHXDEN,3,Final,5,2024-10-13T00:00:00Z,1900-01-01T20:30:00Z,2024-10-13T20:30:00Z,2024-10-13T04:00:00Z,1900-01-01T00:30:00Z,2024-10-14T00:30:00Z,2024-10-13T17:30:00Z,2024-10-13T18:30:00Z,Sun,10,0,,false,,Preseason,,,Ball Arena,CO,Denver,N,,,False,1610612743,Nuggets,Denver,DEN,nuggets,0,3,114,0,1610612756,Suns,Phoenix,PHX,suns,3,1,118,0,203999,Nikola,Jokic,1610612743,Denver,Nuggets,DEN,21.0,1629008.0,Michael,Porter Jr.,1610612743.0,Denver,Nuggets,DEN,21.0,1631124.0,Julian,Strawther,1610612743.0,Denver,Nuggets,DEN,21.0,,,,,,,,,natl,tv,2.0,ESPN,ESPN,,,https://www.espn.com/espnplus/player/_/id/4e5f8e91-675f-4699-91bc-72b8961b50c5?ex_cid=nba,-1.0,3.0,,,,,,,,,,,,,,,,,,,,,,,,,,,,,,,home,radio,1730.0,Altitude Sports Radio 92.5 FM,KKSE-FM,,,,1610612743.0,0.0,,,,,,,,,,,away,tv,1000998.0,Arizona's Family 3TV / Arizona's Family Sports,KTVK/KPHE,,,,1610612756.0,0.0,away,radio,1598.0,KMVP 98.7 / S: KSUN,KMVP/KSUN,,,,1610612756.0,0.0,away,ott,1001033.0,Suns Live,DTC-PHX,,,,1610612756.0,0.0
00,2024-25,10/13/2024 00:00:00,0012400044,20241013/DETGSW,3,Final,6,2024-10-13T00:00:00Z,1900-01-01T20:30:00Z,2024-10-13T20:30:00Z,2024-10-13T04:00:00Z,1900-01-01T00:30:00Z,2024-10-14T00:30:00Z,2024-10-13T20:30:00Z,2024-10-13T17:30:00Z,Sun,10,0,,false,,Preseason,,,Chase Center,CA,San Francisco,N,,,False,1610612744,Warriors,Golden State,GSW,warriors,4,0,111,0,1610612765,Pistons,Detroit,DET,pistons,2,2,93,0,1631093,Jaden,Ivey,1610612765,Detroit,Pistons,DET,19.0,,,,,,,,,,,,,,,,,,,,,,,,,,,,,,,,,,,,,,,,,,,,,,,,,,,,,,,home,tv,1097.0,NBCSBA,NBCSBA,,,http://stream.nbcsports.com/rsn/nba-warriors-live-stream,1610612744.0,0.0,home,radio,1597.0,95.7 The Game,KGMZ-FM,,,,1610612744.0,0.0,,,,,,,,,,,,,,,,,,,,,away,radio,1187.0,950 AM,WWJ,,,,1610612765.0,0.0,,,,,,,,,,
00,2024-25,10/14/2024 00:00:00,0012400045,20241014/MEMIND,3,Final,1,2024-10-14T00:00:00Z,1900-01-01T19:00:00Z,2024-10-14T19:00:00Z,2024-10-14T04:00:00Z,1900-01-01T23:00:00Z,2024-10-14T23:00:00Z,2024-10-14T18:00:00Z,2024-10-14T19:00:00Z,Mon,10,0,,false,,Preseason,,,Gainbridge Fieldhouse,IN,Indianapolis,N,,,False,1610612754,Pacers,Indiana,IND,pacers,1,2,116,0,1610612763,Grizzlies,Memphis,MEM,grizzlies,3,1,120,0,1630217,Desmond,Bane,1610612763,Memphis,Grizzlies,MEM,23.0,1641744.0,Zach,Edey,1610612763.0,Memphis,Grizzlies,MEM,23.0,,,,,,,,,,,,,,,,,,,,,,,,,,,,,,,,,,,,,,,,,,,,,,,home,tv,1000341.0,Bally Sports Indiana,BSIN,,,,1610612754.0,0.0,home,radio,1641.0,93.5/107.5 The Fan,WFNI-FM/AM,,,,1610612754.0,0.0,,,,,,,,,,,away,tv,1000355.0,Bally Sports SE-MEM,BSSE-MEM,,,,1610612763.0,0.0,away,radio,1000152.0,ESPN 92.9FM/680AM,WMFS,,,,1610612763.0,0.0,,,,,,,,,,
00,2024-25,10/14/2024 00:00:00,0012400046,20241014/PHIATL,3,Final,2,2024-10-14T00:00:00Z,1900-01-01T19:30:00Z,2024-10-14T19:30:00Z,2024-10-14T04:00:00Z,1900-01-01T23:30:00Z,2024-10-14T23:30:00Z,2024-10-14T19:30:00Z,2024-10-14T19:30:00Z,Mon,10,0,,false,,Preseason,,,State Farm Arena,GA,Atlanta,N,,,False,1610612737,Hawks,Atlanta,ATL,hawks,1,1,89,0,1610612755,76ers,Philadelphia,PHI,sixers,2,2,104,0,1642258,Zaccharie,Risacher,1610612737,Atlanta,Hawks,ATL,14.0,1626162.0,Kelly,Oubre Jr.,1610612755.0,Philadelphia,76ers,PHI,14.0,1630178.0,Tyrese,Maxey,1610612755.0,Philadelphia,76ers,PHI,14.0,,,,,,,,,natl,tv,7.0,NBA TV,NBA TV,,,,-1.0,0.0,,,,,,,,,,,,,,,,,,,,,home,tv,1000356.0,Bally Sports SE-ATL,BSSE-ATL,,,,1610612737.0,0.0,home,radio,1491.0,WZGC,WZGC,,,,1610612737.0,0.0,,,,,,,,,,,,,,,,,,,,,away,radio,1434.0,97.5 The Fanatic,WPEN,,,,1610612755.0,0.0,,,,,,,,,,
00,2024-25,10/14/2024 00:00:00,0012400047,20241014/WASBKN,3,Final,3,2024-10-14T00:00:00Z,1900-01-01T19:30:00Z,2024-10-14T19:30:00Z,2024-10-14T04:00:00Z,1900-01-01T23:30:00Z,2024-10-14T23:30:00Z,2024-10-14T19:30:00Z,2024-10-14T19:30:00Z,Mon,10,0,,false,,Preseason,,,Barclays Center,NY,Brooklyn,N,,,False,1610612751,Nets,Brooklyn,BKN,nets,1,1,131,0,1610612764,Wizards,Washington,WAS,wizards,1,3,92,0,1630560,Cam,Thomas,1610612751,Brooklyn,Nets,BKN,17.0,,,,,,,,,,,,,,,,,,,,,,,,,,,,,,,,,,,,,,,,,,,,,,,,,,,,,,,home,tv,175.0,YES,YES,,,,1610612751.0,0.0,,,,,,,,,,,,,,,,,,,,,away,tv,1001046.0,Monumental Sports Network,MNMT,,,,1610612764.0,0.0,away,radio,1001049.0,The Team 980 AM / WFED 1500 AM,WTEM/WFED,,,,1610612764.0,0.0,,,,,,,,,,
00,2024-25,10/14/2024 00:00:00,0012400048,20241014/CHIMIL,3,Final,4,2024-10-14T00:00:00Z,1900-01-01T20:00:00Z,2024-10-14T20:00:00Z,2024-10-14T04:00:00Z,1900-01-01T00:00:00Z,2024-10-15T00:00:00Z,2024-10-14T19:00:00Z,2024-10-14T19:00:00Z,Mon,10,0,,false,,Preseason,,,Fiserv Forum,WI,Milwaukee,N,,,False,1610612749,Bucks,Milwaukee,MIL,bucks,1,2,111,0,1610612741,Bulls,Chicago,CHI,bulls,1,2,107,0,203507,Giannis,Antetokounmpo,1610612749,Milwaukee,Bucks,MIL,24.0,,,,,,,,,,,,,,,,,,,,,,,,,,,,,,,,,,,,,,,,,,,,,,,,,,,,,,,home,tv,1000351.0,Bally Sports WI,BSWI,,,,1610612749.0,0.0,home,radio,1697.0,620 AM/103.3 FM WTMJ,WTMJ-AM/FM,,,,1610612749.0,0.0,,,,,,,,,,,away,tv,1001208.0,Chicago Sports Network,CHSN,,,,1610612741.0,0.0,,,,,,,,,,,,,,,,,,,,
00,2024-25,10/14/2024 00:00:00,0012400049,20241014/DALLAC,3,Final,5,2024-10-14T00:00:00Z,1900-01-01T22:30:00Z,2024-10-14T22:30:00Z,2024-10-14T04:00:00Z,1900-01-01T02:30:00Z,2024-10-15T02:30:00Z,2024-10-14T21:30:00Z,2024-10-14T19:30:00Z,Mon,10,0,,false,,Preseason,,,Intuit Dome,CA,Inglewood,N,,,False,1610612746,Clippers,LA,LAC,clippers,3,1,110,0,1610612742,Mavericks,Dallas,DAL,mavericks,0,3,96,0,1629656,Quentin,Grimes,1610612742,Dallas,Mavericks,DAL,20.0,,,,,,,,,,,,,,,,,,,,,,,,,natl,tv,7.0,NBA TV,NBA TV,,,,-1.0,0.0,,,,,,,,,,,,,,,,,,,,,home,tv,172.0,KTLA,KTLA,,,,1610612746.0,0.0,,,,,,,,,,,home,ott,1001036.0,ClipperVision,DTC-LAC,,,,1610612746.0,0.0,away,tv,1000218.0,Mavs.com,Mavs.com,,,,1610612742.0,0.0,away,radio,1000695.0,97.1 FM / S: 99.1 FM,KEGL/KFZO,,,,1610612742.0,0.0,,,,,,,,,,
00,2024-25,10/15/2024 00:00:00,0012400050,20241015/BOSTOR,3,Final,1,2024-10-15T00:00:00Z,1900-01-01T19:00:00Z,2024-10-15T19:00:00Z,2024-10-15T04:00:00Z,1900-01-01T23:00:00Z,2024-10-15T23:00:00Z,2024-10-15T19:00:00Z,2024-10-15T19:00:00Z,Tue,10,0,,false,,Preseason,,,Scotiabank Arena,ON,Toronto,N,,,False,1610612761,Raptors,Toronto,TOR,raptors,2,2,119,0,1610612738,Celtics,Boston,BOS,celtics,4,1,118,0,1641711,Gradey,Dick,1610612761,Toronto,Raptors,TOR,27.0,,,,,,,,,,,,,,,,,,,,,,,,,,,,,,,,,,,,,,,,,,,,,,,,,,,,,,,home,tv,1563.0,SN,SN,,,,1610612761.0,0.0,home,radio,1053.0,Sportsnet 590,CJCL,,,,1610612761.0,0.0,,,,,,,,,,,away,tv,1658.0,NBC SPORTS BOSTON,NBCSB,,,,1610612738.0,0.0,away,radio,1471.0,98.5 The Sports Hub,WBZ-FM,,,,1610612738.0,0.0,,,,,,,,,,
00,2024-25,10/15/2024 00:00:00,0012400051,20241015/SASMIA,3,Final,2,2024-10-15T00:00:00Z,1900-01-01T19:30:00Z,2024-10-15T19:30:00Z,2024-10-15T04:00:00Z,1900-01-01T23:30:00Z,2024-10-15T23:30:00Z,2024-10-15T18:30:00Z,2024-10-15T19:30:00Z,Tue,10,0,,false,,Preseason,,,Kaseya Center,FL,Miami,N,,,False,1610612748,Heat,Miami,MIA,heat,2,1,120,0,1610612759,Spurs,San Antonio,SAS,spurs,2,2,117,0,1628389,Bam,Adebayo,1610612748,Miami,Heat,MIA,20.0,,,,,,,,,,,,,,,,,,,,,,,,,natl,tv,7.0,NBA TV,NBA TV,,,,-1.0,0.0,,,,,,,,,,,,,,,,,,,,,home,tv,1000354.0,Bally Sports Sun,BSSUN,,,,1610612748.0,0.0,home,radio,1000851.0,WQAM 560 / S: WAQI 710,WQAM/WAQI,,,,1610612748.0,0.0,,,,,,,,,,,away,tv,1000344.0,Bally Sports SW-SA,BSSW-SA,,,,1610612759.0,0.0,away,radio,1033.0,WOAI 1200AM,WOAI,,,,1610612759.0,0.0,,,,,,,,,,
00,2024-25,10/15/2024 00:00:00,0012400052,20241015/CHANYK,3,Final,3,2024-10-15T00:00:00Z,1900-01-01T19:30:00Z,2024-10-15T19:30:00Z,2024-10-15T04:00:00Z,1900-01-01T23:30:00Z,2024-10-15T23:30:00Z,2024-10-15T19:30:00Z,2024-10-15T19:30:00Z,Tue,10,0,,false,,Preseason,,,Madison Square Garden,NY,New York,N,,,False,1610612752,Knicks,New York,NYK,knicks,4,0,111,0,1610612766,Hornets,Charlotte,CHA,hornets,2,2,105,0,1641706,Brandon,Miller,1610612766,Charlotte,Hornets,CHA,26.0,,,,,,,,,,,,,,,,,,,,,,,,,,,,,,,,,,,,,,,,,,,,,,,,,,,,,,,home,tv,100.0,MSG,MSG,,,,1610612752.0,0.0,,,,,,,,,,,,,,,,,,,,,,,,,,,,,,,away,radio,1000862.0,WFNZ 92.7 FM,WFNZ-FM,,,,1610612766.0,0.0,,,,,,,,,,
00,2024-25,10/15/2024 00:00:00,0012400053,20241015/NOPHOU,3,Final,4,2024-10-15T00:00:00Z,1900-01-01T20:00:00Z,2024-10-15T20:00:00Z,2024-10-15T04:00:00Z,1900-01-01T00:00:00Z,2024-10-16T00:00:00Z,2024-10-15T19:00:00Z,2024-10-15T19:00:00Z,Tue,10,0,,false,,Preseason,,,Toyota Center,TX,Houston,N,,,False,1610612745,Rockets,Houston,HOU,rockets,2,1,118,0,1610612740,Pelicans,New Orleans,NOP,pelicans,1,2,98,0,1641722,Jordan,Hawkins,1610612740,New Orleans,Pelicans,NOP,20.0,,,,,,,,,,,,,,,,,,,,,,,,,,,,,,,,,,,,,,,,,,,,,,,,,,,,,,,home,tv,1001056.0,Space City Home Network,SCHN,,,,1610612745.0,0.0,home,radio,1000699.0,790 AM / S: 93.3 FM,KBME/KQBU-FM,,,,1610612745.0,0.0,,,,,,,,,,,away,tv,1001211.0,GCSEN,GCSEN,,,,1610612740.0,0.0,away,radio,1437.0,WWL 870 AM / 105.3 FM,WWL,,,,1610612740.0,0.0,,,,,,,,,,
00,2024-25,10/15/2024 00:00:00,0012400054,20241015/OKCDEN,3,Final,5,2024-10-15T00:00:00Z,1900-01-01T21:00:00Z,2024-10-15T21:00:00Z,2024-10-15T04:00:00Z,1900-01-01T01:00:00Z,2024-10-16T01:00:00Z,2024-10-15T20:00:00Z,2024-10-15T19:00:00Z,Tue,10,0,,false,,Preseason,,,Ball Arena,CO,Denver,N,,,False,1610612743,Nuggets,Denver,DEN,nuggets,0,4,94,0,1610612760,Thunder,Oklahoma City,OKC,thunder,3,1,124,0,1628983,Shai,Gilgeous-Alexander,1610612760,Oklahoma City,Thunder,OKC,19.0,,,,,,,,,,,,,,,,,,,,,,,,,,,,,,,,,,,,,,,,,,,,,,,,,,,,,,,,,,,,,,,,,home,radio,1730.0,Altitude Sports Radio 92.5 FM,KKSE-FM,,,,1610612743.0,0.0,,,,,,,,,,,away,tv,1000345.0,Bally Sports OK,BSOK,,,,1610612760.0,0.0,away,radio,1140.0,WWLS 98.1FM OKC,WWLS,,,,1610612760.0,0.0,,,,,,,,,,
00,2024-25,10/15/2024 00:00:00,0012400055,20241015/SACUTA,3,Final,6,2024-10-15T00:00:00Z,1900-01-01T21:00:00Z,2024-10-15T21:00:00Z,2024-10-15T04:00:00Z,1900-01-01T01:00:00Z,2024-10-16T01:00:00Z,2024-10-15T18:00:00Z,2024-10-15T19:00:00Z,Tue,10,0,,false,,Preseason,,,Delta Center,UT,Salt Lake City,N,,,False,1610612762,Jazz,Utah,UTA,jazz,4,1,117,0,1610612758,Kings,Sacramento,SAC,kings,0,4,114,0,1627734,Domantas,Sabonis,1610612758,Sacramento,Kings,SAC,29.0,,,,,,,,,,,,,,,,,,,,,,,,,,,,,,,,,,,,,,,,,,,,,,,,,,,,,,,home,tv,122.0,KJZZ,KJZZ,,,,1610612762.0,0.0,home,radio,1001084.0,KSL 97.5 FM / S: KBMG 106.3 FM,KSL-FM/KBMG,,,,1610612762.0,0.0,,,,,,,,,,,away,tv,1000214.0,Kings.com/live,Kings.com,,,,1610612758.0,0.0,away,radio,1052.0,Sactown Sports 1140 AM,KHTK,,,,1610612758.0,0.0,,,,,,,,,,
00,2024-25,10/15/2024 00:00:00,0012400056,20241015/GSWLAL,3,Final,7,2024-10-15T00:00:00Z,1900-01-01T22:00:00Z,2024-10-15T22:00:00Z,2024-10-15T04:00:00Z,1900-01-01T02:00:00Z,2024-10-16T02:00:00Z,2024-10-15T19:00:00Z,2024-10-15T19:00:00Z,Tue,10,0,,false,,Preseason,,,T-Mobile Arena,NV,Las Vegas,N,,,False,1610612747,Lakers,Los Angeles,LAL,lakers,1,3,97,0,1610612744,Warriors,Golden State,GSW,warriors,5,0,111,0,203076,Anthony,Davis,1610612747,Los Angeles,Lakers,LAL,24.0,,,,,,,,,,,,,,,,,,,,,,,,,natl,tv,7.0,NBA TV,NBA TV,,,,-1.0,0.0,,,,,,,,,,,,,,,,,,,,,home,tv,1651.0,Spectrum SportsNet,SPECSN,,,,1610612747.0,0.0,home,radio,1000286.0,ESPN LA 710/1330 KWKW,KSPN/KWKW-LAL,,,,1610612747.0,0.0,home,ott,1001037.0,Spectrum SportsNet+,DTC-LAL,,,,1610612747.0,0.0,,,,,,,,,,,away,radio,1597.0,95.7 The Game,KGMZ-FM,,,,1610612744.0,0.0,,,,,,,,,,
00,2024-25,10/16/2024 00:00:00,0012400025,20241016/ATLMIA,3,Final,3,2024-10-16T00:00:00Z,1900-01-01T19:30:00Z,2024-10-16T19:30:00Z,2024-10-16T04:00:00Z,1900-01-01T23:30:00Z,2024-10-16T23:30:00Z,2024-10-16T19:30:00Z,2024-10-16T19:30:00Z,Wed,10,0,,false,,Preseason,,,Kaseya Center,FL,Miami,N,,,False,1610612748,Heat,Miami,MIA,heat,3,1,120,0,1610612737,Hawks,Atlanta,ATL,hawks,1,2,111,0,202710,Jimmy,Butler,1610612748,Miami,Heat,MIA,24.0,,,,,,,,,,,,,,,,,,,,,,,,,,,,,,,,,,,,,,,,,,,,,,,,,,,,,,,home,tv,1000354.0,Bally Sports Sun,BSSUN,,,,1610612748.0,0.0,home,radio,1000851.0,WQAM 560 / S: WAQI 710,WQAM/WAQI,,,,1610612748.0,0.0,,,,,,,,,,,away,tv,1000356.0,Bally Sports SE-ATL,BSSE-ATL,,,,1610612737.0,0.0,,,,,,,,,,,,,,,,,,,,
00,2024-25,10/16/2024 00:00:00,0012400057,20241016/CLEDET,3,Final,1,2024-10-16T00:00:00Z,1900-01-01T19:00:00Z,2024-10-16T19:00:00Z,2024-10-16T04:00:00Z,1900-01-01T23:00:00Z,2024-10-16T23:00:00Z,2024-10-16T19:00:00Z,2024-10-16T19:00:00Z,Wed,10,0,,false,,Preseason,,,Little Caesars Arena,MI,Detroit,N,,,False,1610612765,Pistons,Detroit,DET,pistons,3,2,108,0,1610612739,Cavaliers,Cleveland,CLE,cavaliers,0,3,92,0,1628386,Jarrett,Allen,1610612739,Cleveland,Cavaliers,CLE,19.0,,,,,,,,,,,,,,,,,,,,,,,,,natl,tv,7.0,NBA TV,NBA TV,,,,-1.0,0.0,,,,,,,,,,,,,,,,,,,,,home,tv,1000339.0,Bally Sports DET,BSDET,,,,1610612765.0,0.0,home,radio,1188.0,97.1 FM The Ticket,WXYT,,,,1610612765.0,0.0,,,,,,,,,,,away,tv,1000358.0,Bally Sports Ohio,BSOH,,,,1610612739.0,0.0,away,radio,1040.0,WTAM/WMMS,WTAM/WMMS,,,,1610612739.0,0.0,,,,,,,,,,
00,2024-25,10/16/2024 00:00:00,0012400058,20241016/BKNPHI,3,Final,2,2024-10-16T00:00:00Z,1900-01-01T19:00:00Z,2024-10-16T19:00:00Z,2024-10-16T04:00:00Z,1900-01-01T23:00:00Z,2024-10-16T23:00:00Z,2024-10-16T19:00:00Z,2024-10-16T19:00:00Z,Wed,10,0,,false,,Preseason,,,Wells Fargo Center,PA,Philadelphia,N,,,False,1610612755,76ers,Philadelphia,PHI,sixers,3,2,117,0,1610612751,Nets,Brooklyn,BKN,nets,1,2,95,0,1626162,Kelly,Oubre Jr.,1610612755,Philadelphia,76ers,PHI,18.0,,,,,,,,,,,,,,,,,,,,,,,,,,,,,,,,,,,,,,,,,,,,,,,,,,,,,,,home,tv,133.0,NBC Sports Philadelphia,NBCSP,,,,1610612755.0,0.0,home,radio,1434.0,97.5 The Fanatic,WPEN,,,,1610612755.0,0.0,,,,,,,,,,,away,tv,175.0,YES,YES,,,,1610612751.0,0.0,,,,,,,,,,,,,,,,,,,,
00,2024-25,10/16/2024 00:00:00,0012400059,20241016/MINCHI,3,Final,4,2024-10-16T00:00:00Z,1900-01-01T20:00:00Z,2024-10-16T20:00:00Z,2024-10-16T04:00:00Z,1900-01-01T00:00:00Z,2024-10-17T00:00:00Z,2024-10-16T19:00:00Z,2024-10-16T19:00:00Z,Wed,10,0,,false,,Preseason,,,United Center,IL,Chicago,N,,,False,1610612741,Bulls,Chicago,CHI,bulls,2,2,125,0,1610612750,Timberwolves,Minnesota,MIN,timberwolves,2,2,123,0,1629632,Coby,White,1610612741,Chicago,Bulls,CHI,23.0,,,,,,,,,,,,,,,,,,,,,,,,,,,,,,,,,,,,,,,,,,,,,,,,,,,,,,,home,tv,1001208.0,Chicago Sports Network,CHSN,,,,1610612741.0,0.0,home,radio,1687.0,670 The Score,WSCR,,,,1610612741.0,0.0,,,,,,,,,,,away,tv,1000347.0,Bally Sports North,BSN,,,,1610612750.0,0.0,away,radio,1001054.0,Wolves App / iHeart Radio,MIN App,,,,1610612750.0,0.0,,,,,,,,,,
00,2024-25,10/16/2024 00:00:00,0012400060,20241016/ULMPOR,3,Final,5,2024-10-16T00:00:00Z,1900-01-01T22:00:00Z,2024-10-16T22:00:00Z,2024-10-16T04:00:00Z,1900-01-01T02:00:00Z,2024-10-17T02:00:00Z,2024-10-17T04:00:00Z,2024-10-16T19:00:00Z,Wed,10,0,,false,,Preseason,,,Moda Center,OR,Portland,N,,,False,1610612757,Trail Blazers,Portland,POR,blazers,2,1,111,0,15025,Ulm,Ratiopharm,ULM,ulm,0,1,100,0,1630703,Scoot,Henderson,1610612757,Portland,Trail Blazers,POR,23.0,,,,,,,,,,,,,,,,,,,,,,,,,,,,,,,,,,,,,,,,,,,,,,,,,,,,,,,,,,,,,,,,,home,radio,1472.0,Rip City Radio 620,KPOJ,,,,1610612757.0,0.0,,,,,,,,,,,,,,,,,,,,,,,,,,,,,,,,,,,,,,,,
00,2024-25,10/17/2024 00:00:00,0012400061,20241017/CHAIND,3,Final/OT,1,2024-10-17T00:00:00Z,1900-01-01T19:00:00Z,2024-10-17T19:00:00Z,2024-10-17T04:00:00Z,1900-01-01T23:00:00Z,2024-10-17T23:00:00Z,2024-10-17T19:00:00Z,2024-10-17T19:00:00Z,Thu,10,0,,false,,Preseason,,,Gainbridge Fieldhouse,IN,Indianapolis,N,,,False,1610612754,Pacers,Indiana,IND,pacers,2,2,121,0,1610612766,Hornets,Charlotte,CHA,hornets,2,3,116,0,1641706,Brandon,Miller,1610612766,Charlotte,Hornets,CHA,20.0,,,,,,,,,,,,,,,,,,,,,,,,,,,,,,,,,,,,,,,,,,,,,,,,,,,,,,,home,tv,1000341.0,Bally Sports Indiana,BSIN,,,,1610612754.0,0.0,home,radio,1641.0,93.5/107.5 The Fan,WFNI-FM/AM,,,,1610612754.0,0.0,,,,,,,,,,,away,tv,1000357.0,Bally Sports SE-CHA,BSSE-CHA,,,,1610612766.0,0.0,away,radio,1000862.0,WFNZ 92.7 FM,WFNZ-FM,,,,1610612766.0,0.0,,,,,,,,,,
00,2024-25,10/17/2024 00:00:00,0012400062,20241017/MILDAL,3,Final,2,2024-10-17T00:00:00Z,1900-01-01T19:30:00Z,2024-10-17T19:30:00Z,2024-10-17T04:00:00Z,1900-01-01T23:30:00Z,2024-10-17T23:30:00Z,2024-10-17T18:30:00Z,2024-10-17T18:30:00Z,Thu,10,0,,false,,Preseason,,,American Airlines Center,TX,Dallas,N,,,False,1610612742,Mavericks,Dallas,DAL,mavericks,1,3,109,0,1610612749,Bucks,Milwaukee,MIL,bucks,1,3,84,0,202681,Kyrie,Irving,1610612742,Dallas,Mavericks,DAL,14.0,,,,,,,,,,,,,,,,,,,,,,,,,natl,tv,10.0,TNT,TNT,,,https://www.tntdrama.com/nba-on-tnt,-1.0,0.0,,,,,,,,,,,,,,,,,,,,,home,tv,1000218.0,Mavs.com,Mavs.com,,,,1610612742.0,0.0,home,radio,1000695.0,97.1 FM / S: 99.1 FM,KEGL/KFZO,,,,1610612742.0,0.0,,,,,,,,,,,away,tv,1000351.0,Bally Sports WI,BSWI,,,,1610612749.0,0.0,away,radio,1697.0,620 AM/103.3 FM WTMJ,WTMJ-AM/FM,,,,1610612749.0,0.0,,,,,,,,,,
00,2024-25,10/17/2024 00:00:00,0012400063,20241017/SASHOU,3,Final,3,2024-10-17T00:00:00Z,1900-01-01T20:00:00Z,2024-10-17T20:00:00Z,2024-10-17T04:00:00Z,1900-01-01T00:00:00Z,2024-10-18T00:00:00Z,2024-10-17T19:00:00Z,2024-10-17T19:00:00Z,Thu,10,0,,false,,Preseason,,,Toyota Center,TX,Houston,N,,,False,1610612745,Rockets,Houston,HOU,rockets,3,1,129,0,1610612759,Spurs,San Antonio,SAS,spurs,2,3,107,0,1630224,Jalen,Green,1610612745,Houston,Rockets,HOU,30.0,,,,,,,,,,,,,,,,,,,,,,,,,,,,,,,,,,,,,,,,,,,,,,,,,,,,,,,home,tv,1001056.0,Space City Home Network,SCHN,,,,1610612745.0,0.0,home,radio,1000702.0,740 AM / S: 93.3 FM,KTRH/KQBU-FM,,,,1610612745.0,0.0,,,,,,,,,,,away,tv,1000696.0,CW35,CW35,,,,1610612759.0,0.0,away,radio,1033.0,WOAI 1200AM,WOAI,,,,1610612759.0,0.0,,,,,,,,,,
00,2024-25,10/17/2024 00:00:00,0012400064,20241017/ATLOKC,3,Final,4,2024-10-17T00:00:00Z,1900-01-01T20:00:00Z,2024-10-17T20:00:00Z,2024-10-17T04:00:00Z,1900-01-01T00:00:00Z,2024-10-18T00:00:00Z,2024-10-17T20:00:00Z,2024-10-17T19:00:00Z,Thu,10,0,,false,,Preseason,,,Paycom Center,OK,Oklahoma City,N,,,False,1610612760,Thunder,Oklahoma City,OKC,thunder,4,1,104,0,1610612737,Hawks,Atlanta,ATL,hawks,1,3,99,0,1641723,Kobe,Bufkin,1610612737,Atlanta,Hawks,ATL,31.0,,,,,,,,,,,,,,,,,,,,,,,,,,,,,,,,,,,,,,,,,,,,,,,,,,,,,,,home,tv,1000345.0,Bally Sports OK,BSOK,,,,1610612760.0,0.0,home,radio,1574.0,WWLS/WKY,WWLS/WKY,,,,1610612760.0,0.0,,,,,,,,,,,away,tv,1000356.0,Bally Sports SE-ATL,BSSE-ATL,,,,1610612737.0,0.0,away,radio,1491.0,WZGC,WZGC,,,,1610612737.0,0.0,,,,,,,,,,
00,2024-25,10/17/2024 00:00:00,0012400065,20241017/LALPHX,3,Final/OT,6,2024-10-17T00:00:00Z,1900-01-01T22:00:00Z,2024-10-17T22:00:00Z,2024-10-17T04:00:00Z,1900-01-01T02:00:00Z,2024-10-18T02:00:00Z,2024-10-17T19:00:00Z,2024-10-17T19:00:00Z,Thu,10,0,,false,,Preseason,,,Footprint Center,AZ,Phoenix,N,,,False,1610612756,Suns,Phoenix,PHX,suns,3,2,122,0,1610612747,Lakers,Los Angeles,LAL,lakers,2,3,128,0,203076,Anthony,Davis,1610612747,Los Angeles,Lakers,LAL,35.0,1642261.0,Dalton,Knecht,1610612747.0,Los Angeles,Lakers,LAL,35.0,,,,,,,,,,,,,,,,,natl,tv,10.0,TNT,TNT,,,https://www.tntdrama.com/nba-on-tnt,-1.0,0.0,,,,,,,,,,,,,,,,,,,,,home,tv,1000998.0,Arizona's Family 3TV / Arizona's Family Sports,KTVK/KPHE,,,,1610612756.0,0.0,home,radio,1598.0,KMVP 98.7 / S: KSUN,KMVP/KSUN,,,,1610612756.0,0.0,home,ott,1001033.0,Suns Live,DTC-PHX,,,,1610612756.0,0.0,away,tv,1651.0,Spectrum SportsNet,SPECSN,,,,1610612747.0,0.0,away,radio,1000286.0,ESPN LA 710/1330 KWKW,KSPN/KWKW-LAL,,,,1610612747.0,0.0,away,ott,1001037.0,Spectrum SportsNet+,DTC-LAL,,,,1610612747.0,0.0
00,2024-25,10/17/2024 00:00:00,0012400066,20241017/SACLAC,3,Final,7,2024-10-17T00:00:00Z,1900-01-01T22:30:00Z,2024-10-17T22:30:00Z,2024-10-17T04:00:00Z,1900-01-01T02:30:00Z,2024-10-18T02:30:00Z,2024-10-17T19:30:00Z,2024-10-17T19:30:00Z,Thu,10,0,,false,,Preseason,,,Intuit Dome,CA,Inglewood,N,,,False,1610612746,Clippers,LA,LAC,clippers,4,1,113,0,1610612758,Kings,Sacramento,SAC,kings,0,5,91,0,1627734,Domantas,Sabonis,1610612758,Sacramento,Kings,SAC,24.0,,,,,,,,,,,,,,,,,,,,,,,,,,,,,,,,,,,,,,,,,,,,,,,,,,,,,,,home,tv,172.0,KTLA,KTLA,,,,1610612746.0,0.0,,,,,,,,,,,home,ott,1001036.0,ClipperVision,DTC-LAC,,,,1610612746.0,0.0,away,tv,1000214.0,Kings.com/live,Kings.com,,,,1610612758.0,0.0,away,radio,1052.0,Sactown Sports 1140 AM,KHTK,,,,1610612758.0,0.0,,,,,,,,,,
00,2024-25,10/17/2024 00:00:00,0012400072,20241017/DENMIN,3,Final,5,2024-10-17T00:00:00Z,1900-01-01T20:00:00Z,2024-10-17T20:00:00Z,2024-10-17T04:00:00Z,1900-01-01T00:00:00Z,2024-10-18T00:00:00Z,2024-10-17T18:00:00Z,2024-10-17T19:00:00Z,Thu,10,0,,false,,Preseason,,,Target Center,MN,Minneapolis,N,,,False,1610612750,Timberwolves,Minnesota,MIN,timberwolves,2,3,126,0,1610612743,Nuggets,Denver,DEN,nuggets,1,4,132,0,1631124,Julian,Strawther,1610612743,Denver,Nuggets,DEN,33.0,,,,,,,,,,,,,,,,,,,,,,,,,,,,,,,,,,,,,,,,,,,,,,,,,,,,,,,home,tv,1000347.0,Bally Sports North,BSN,,,,1610612750.0,0.0,home,radio,1001054.0,Wolves App / iHeart Radio,MIN App,,,,1610612750.0,0.0,,,,,,,,,,,,,,,,,,,,,away,radio,1730.0,Altitude Sports Radio 92.5 FM,KKSE-FM,,,,1610612743.0,0.0,,,,,,,,,,
00,2024-25,10/18/2024 00:00:00,0012400067,20241018/PHIORL,3,Final,1,2024-10-18T00:00:00Z,1900-01-01T19:00:00Z,2024-10-18T19:00:00Z,2024-10-18T04:00:00Z,1900-01-01T23:00:00Z,2024-10-18T23:00:00Z,2024-10-18T19:00:00Z,2024-10-18T19:00:00Z,Fri,10,0,,false,,Preseason,,,Kia Center,FL,Orlando,N,,,False,1610612753,Magic,Orlando,ORL,magic,1,2,114,0,1610612755,76ers,Philadelphia,PHI,sixers,3,3,99,0,1631094,Paolo,Banchero,1610612753,Orlando,Magic,ORL,21.0,,,,,,,,,,,,,,,,,,,,,,,,,,,,,,,,,,,,,,,,,,,,,,,,,,,,,,,home,tv,1000353.0,Bally Sports Florida,BSFL,,,,1610612753.0,0.0,home,radio,1000273.0,WYGM 96.9 FM / 740AM,WYGM-FM/AM,,,,1610612753.0,0.0,,,,,,,,,,,,,,,,,,,,,away,radio,1434.0,97.5 The Fanatic,WPEN,,,,1610612755.0,0.0,,,,,,,,,,
00,2024-25,10/18/2024 00:00:00,0012400068,20241018/NYKWAS,3,Final,2,2024-10-18T00:00:00Z,1900-01-01T19:00:00Z,2024-10-18T19:00:00Z,2024-10-18T04:00:00Z,1900-01-01T23:00:00Z,2024-10-18T23:00:00Z,2024-10-18T19:00:00Z,2024-10-18T19:00:00Z,Fri,10,0,,false,,Preseason,,,Capital One Arena,DC,Washington,N,,,False,1610612764,Wizards,Washington,WAS,wizards,2,3,118,0,1610612752,Knicks,New York,NYK,knicks,4,1,117,0,1628973,Jalen,Brunson,1610612752,New York,Knicks,NYK,27.0,,,,,,,,,,,,,,,,,,,,,,,,,,,,,,,,,,,,,,,,,,,,,,,,,,,,,,,home,tv,1001046.0,Monumental Sports Network,MNMT,,,,1610612764.0,0.0,home,radio,1001049.0,The Team 980 AM / WFED 1500 AM,WTEM/WFED,,,,1610612764.0,0.0,,,,,,,,,,,away,tv,100.0,MSG,MSG,,,,1610612752.0,0.0,,,,,,,,,,,,,,,,,,,,
00,2024-25,10/18/2024 00:00:00,0012400069,20241018/TORBKN,3,Final,3,2024-10-18T00:00:00Z,1900-01-01T19:30:00Z,2024-10-18T19:30:00Z,2024-10-18T04:00:00Z,1900-01-01T23:30:00Z,2024-10-18T23:30:00Z,2024-10-18T19:30:00Z,2024-10-18T19:30:00Z,Fri,10,0,,false,,Preseason,,,Barclays Center,NY,Brooklyn,N,,,False,1610612751,Nets,Brooklyn,BKN,nets,1,3,112,0,1610612761,Raptors,Toronto,TOR,raptors,3,2,116,0,1629661,Cameron,Johnson,1610612751,Brooklyn,Nets,BKN,32.0,,,,,,,,,,,,,,,,,,,,,,,,,,,,,,,,,,,,,,,,,,,,,,,,,,,,,,,home,tv,175.0,YES,YES,,,,1610612751.0,0.0,,,,,,,,,,,,,,,,,,,,,away,tv,11.0,TSN,TSN,,,,1610612761.0,0.0,,,,,,,,,,,,,,,,,,,,
00,2024-25,10/18/2024 00:00:00,0012400070,20241018/CLECHI,3,Final/OT,4,2024-10-18T00:00:00Z,1900-01-01T20:00:00Z,2024-10-18T20:00:00Z,2024-10-18T04:00:00Z,1900-01-01T00:00:00Z,2024-10-19T00:00:00Z,2024-10-18T20:00:00Z,2024-10-18T19:00:00Z,Fri,10,0,,false,,Preseason,,,United Center,IL,Chicago,N,,,False,1610612741,Bulls,Chicago,CHI,bulls,3,2,139,0,1610612739,Cavaliers,Cleveland,CLE,cavaliers,0,4,137,0,1628386,Jarrett,Allen,1610612739,Cleveland,Cavaliers,CLE,25.0,,,,,,,,,,,,,,,,,,,,,,,,,,,,,,,,,,,,,,,,,,,,,,,,,,,,,,,home,tv,1001208.0,Chicago Sports Network,CHSN,,,,1610612741.0,0.0,home,radio,1687.0,670 The Score,WSCR,,,,1610612741.0,0.0,,,,,,,,,,,away,tv,1000358.0,Bally Sports Ohio,BSOH,,,,1610612739.0,0.0,away,radio,1181.0,100.7 WMMS,WMMS,,,,1610612739.0,0.0,,,,,,,,,,
00,2024-25,10/18/2024 00:00:00,0012400071,20241018/MIAMEM,3,Final,5,2024-10-18T00:00:00Z,1900-01-01T20:00:00Z,2024-10-18T20:00:00Z,2024-10-18T04:00:00Z,1900-01-01T00:00:00Z,2024-10-19T00:00:00Z,2024-10-18T20:00:00Z,2024-10-18T19:00:00Z,Fri,10,0,,false,,Preseason,,,FedExForum,TN,Memphis,N,,,False,1610612763,Grizzlies,Memphis,MEM,grizzlies,3,2,109,0,1610612748,Heat,Miami,MIA,heat,4,1,114,0,1630217,Desmond,Bane,1610612763,Memphis,Grizzlies,MEM,19.0,1630583.0,Santi,Aldama,1610612763.0,Memphis,Grizzlies,MEM,19.0,,,,,,,,,,,,,,,,,natl,tv,7.0,NBA TV,NBA TV,,,,-1.0,0.0,,,,,,,,,,,,,,,,,,,,,home,tv,1000355.0,Bally Sports SE-MEM,BSSE-MEM,,,,1610612763.0,0.0,home,radio,1000152.0,ESPN 92.9FM/680AM,WMFS,,,,1610612763.0,0.0,,,,,,,,,,,away,tv,1000354.0,Bally Sports Sun,BSSUN,,,,1610612748.0,0.0,away,radio,1000832.0,WQAM 560,WQAM,,,,1610612748.0,0.0,,,,,,,,,,
00,2024-25,10/18/2024 00:00:00,0012400073,20241018/UTAPOR,3,Final,6,2024-10-18T00:00:00Z,1900-01-01T22:00:00Z,2024-10-18T22:00:00Z,2024-10-18T04:00:00Z,1900-01-01T02:00:00Z,2024-10-19T02:00:00Z,2024-10-18T20:00:00Z,2024-10-18T19:00:00Z,Fri,10,0,,false,,Preseason,,,Moda Center,OR,Portland,N,,,False,1610612757,Trail Blazers,Portland,POR,blazers,3,1,124,0,1610612762,Jazz,Utah,UTA,jazz,4,2,86,0,1641712,Rayan,Rupert,1610612757,Portland,Trail Blazers,POR,20.0,,,,,,,,,,,,,,,,,,,,,,,,,,,,,,,,,,,,,,,,,,,,,,,,,,,,,,,home,tv,1001197.0,KATU 2.2,KATU 2.2,,,,1610612757.0,0.0,home,radio,1472.0,Rip City Radio 620,KPOJ,,,,1610612757.0,0.0,home,ott,1001128.0,BlazerVision,DTC-POR,,,,1610612757.0,0.0,away,tv,122.0,KJZZ,KJZZ,,,,1610612762.0,0.0,away,radio,1001084.0,KSL 97.5 FM / S: KBMG 106.3 FM,KSL-FM/KBMG,,,,1610612762.0,0.0,,,,,,,,,,
00,2024-25,10/18/2024 00:00:00,0012400074,20241018/LALGSW,3,Final,7,2024-10-18T00:00:00Z,1900-01-01T22:30:00Z,2024-10-18T22:30:00Z,2024-10-18T04:00:00Z,1900-01-01T02:30:00Z,2024-10-19T02:30:00Z,2024-10-18T19:30:00Z,2024-10-18T19:30:00Z,Fri,10,0,,false,,Preseason,,,Chase Center,CA,San Francisco,N,,,False,1610612744,Warriors,Golden State,GSW,warriors,6,0,132,0,1610612747,Lakers,Los Angeles,LAL,lakers,2,4,74,0,1642439,Quincy,Olivari,1610612747,Los Angeles,Lakers,LAL,22.0,,,,,,,,,,,,,,,,,,,,,,,,,natl,tv,127.0,ESPN2,ESPN2,,,https://www.espn.com/espnplus/player/_/id/9f2bc324-5c24-4e5c-b241-e157ef963cce?ex_cid=nba,-1.0,5.0,,,,,,,,,,,,,,,,,,,,,,,,,,,,,,,home,radio,1597.0,95.7 The Game,KGMZ-FM,,,,1610612744.0,0.0,,,,,,,,,,,away,tv,1651.0,Spectrum SportsNet,SPECSN,,,,1610612747.0,0.0,away,radio,1000286.0,ESPN LA 710/1330 KWKW,KSPN/KWKW-LAL,,,,1610612747.0,0.0,away,ott,1001037.0,Spectrum SportsNet+,DTC-LAL,,,,1610612747.0,0.0
00,2024-25,10/22/2024 00:00:00,0022400061,20241022/NYKBOS,3,Final,1,2024-10-22T00:00:00Z,1900-01-01T19:30:00Z,2024-10-22T19:30:00Z,2024-10-22T04:00:00Z,1900-01-01T23:30:00Z,2024-10-22T23:30:00Z,2024-10-22T19:30:00Z,2024-10-22T19:30:00Z,Tue,10,1,Week 1,false,,,,,TD Garden,MA,Boston,N,,,False,1610612738,Celtics,Boston,BOS,celtics,1,0,132,0,1610612752,Knicks,New York,NYK,knicks,0,1,109,0,1628369,Jayson,Tatum,1610612738,Boston,Celtics,BOS,37.0,,,,,,,,,,,,,,,,,,,,,,,,,natl,tv,1001321.0,TNT/Max,TNT/Max,,,https://www.tntdrama.com/nba-on-tnt,-1.0,0.0,natl,radio,3.0,ESPN Radio,ESPNR,,,,-1.0,0.0,natl,radio,1001098.0,SiriusXM,SiriusXM,,,https://www.siriusxm.com/sports/nba,-1.0,0.0,,,,,,,,,,,home,radio,1471.0,98.5 The Sports Hub,WBZ-FM,,,,1610612738.0,0.0,,,,,,,,,,,,,,,,,,,,,away,radio,1001199.0,880 ESPN New York,WHSQ,,,,1610612752.0,0.0,,,,,,,,,,
00,2024-25,10/22/2024 00:00:00,0022400062,20241022/MINLAL,3,Final,2,2024-10-22T00:00:00Z,1900-01-01T22:00:00Z,2024-10-22T22:00:00Z,2024-10-22T04:00:00Z,1900-01-01T02:00:00Z,2024-10-23T02:00:00Z,2024-10-22T21:00:00Z,2024-10-22T19:00:00Z,Tue,10,1,Week 1,false,,,,,Crypto.com Arena,CA,Los Angeles,N,,,False,1610612747,Lakers,Los Angeles,LAL,lakers,1,0,110,0,1610612750,Timberwolves,Minnesota,MIN,timberwolves,0,1,103,0,203076,Anthony,Davis,1610612747,Los Angeles,Lakers,LAL,36.0,,,,,,,,,,,,,,,,,,,,,,,,,natl,tv,1001321.0,TNT/Max,TNT/Max,,,https://www.tntdrama.com/nba-on-tnt,-1.0,0.0,natl,radio,1001098.0,SiriusXM,SiriusXM,,,https://www.siriusxm.com/sports/nba,-1.0,0.0,,,,,,,,,,,,,,,,,,,,,home,radio,1000286.0,ESPN LA 710/1330 KWKW,KSPN/KWKW-LAL,,,,1610612747.0,0.0,,,,,,,,,,,,,,,,,,,,,away,radio,1001099.0,KFAN FM / Wolves App / iHeart Radio,KFAN/Apps,,,,1610612750.0,0.0,,,,,,,,,,
00,2024-25,10/23/2024 00:00:00,0022400063,20241023/INDDET,3,Final,1,2024-10-23T00:00:00Z,1900-01-01T19:00:00Z,2024-10-23T19:00:00Z,2024-10-23T04:00:00Z,1900-01-01T23:00:00Z,2024-10-23T23:00:00Z,2024-10-23T19:00:00Z,2024-10-23T19:00:00Z,Wed,10,1,Week 1,false,,,,,Little Caesars Arena,MI,Detroit,N,,,False,1610612765,Pistons,Detroit,DET,pistons,0,1,109,0,1610612754,Pacers,Indiana,IND,pacers,1,0,115,0,1630595,Cade,Cunningham,1610612765,Detroit,Pistons,DET,28.0,,,,,,,,,,,,,,,,,,,,,,,,,,,,,,,,,,,natl,radio,1001098.0,SiriusXM,SiriusXM,,,https://www.siriusxm.com/sports/nba,-1.0,0.0,,,,,,,,,,,home,tv,1001235.0,FanDuel Sports Network - Detroit,FDSNDT,,,https://ballysports.app.link/e/CxRVl0qBzNb,1610612765.0,0.0,home,radio,1188.0,97.1 FM The Ticket,WXYT,,,,1610612765.0,0.0,,,,,,,,,,,away,tv,1001236.0,FanDuel Sports Network - Indiana,FDSNIN,,,https://ballysports.app.link/xG8hdGzvoNb,1610612754.0,0.0,away,radio,1641.0,93.5/107.5 The Fan,WFNI-FM/AM,,,,1610612754.0,0.0,,,,,,,,,,
00,2024-25,10/23/2024 00:00:00,0022400064,20241023/BKNATL,3,Final,2,2024-10-23T00:00:00Z,1900-01-01T19:30:00Z,2024-10-23T19:30:00Z,2024-10-23T04:00:00Z,1900-01-01T23:30:00Z,2024-10-23T23:30:00Z,2024-10-23T19:30:00Z,2024-10-23T19:30:00Z,Wed,10,1,Week 1,false,,,,,State Farm Arena,GA,Atlanta,N,,,False,1610612737,Hawks,Atlanta,ATL,hawks,1,0,120,0,1610612751,Nets,Brooklyn,BKN,nets,0,1,116,0,1630560,Cam,Thomas,1610612751,Brooklyn,Nets,BKN,36.0,,,,,,,,,,,,,,,,,,,,,,,,,,,,,,,,,,,natl,radio,1001098.0,SiriusXM,SiriusXM,,,https://www.siriusxm.com/sports/nba,-1.0,0.0,,,,,,,,,,,home,tv,1001230.0,FanDuel Sports Network - Southeast - Atlanta,FDSNSE-ATL,,,https://ballysports.app.link/e/KxYo4n8AzNb,1610612737.0,0.0,home,radio,1491.0,WZGC,WZGC,,,,1610612737.0,0.0,,,,,,,,,,,away,tv,175.0,YES,YES,,,http://onelink.to/yesapp?rel=2020-21_BKN_Schedule&utm_source=brooklynnetsApp&utm_[...]medium=web&utm_campaign=2020-21_BKN_Schedule&utm_content=YesApp,1610612751.0,0.0,away,radio,1020.0,WFAN,WFAN,,,,1610612751.0,0.0,,,,,,,,,,
00,2024-25,10/23/2024 00:00:00,0022400065,20241023/ORLMIA,3,Final,3,2024-10-23T00:00:00Z,1900-01-01T19:30:00Z,2024-10-23T19:30:00Z,2024-10-23T04:00:00Z,1900-01-01T23:30:00Z,2024-10-23T23:30:00Z,2024-10-23T19:30:00Z,2024-10-23T19:30:00Z,Wed,10,1,Week 1,false,,,,,Kaseya Center,FL,Miami,N,,,False,1610612748,Heat,Miami,MIA,heat,0,1,97,0,1610612753,Magic,Orlando,ORL,magic,1,0,116,0,1631094,Paolo,Banchero,1610612753,Orlando,Magic,ORL,33.0,,,,,,,,,,,,,,,,,,,,,,,,,,,,,,,,,,,natl,radio,1001098.0,SiriusXM,SiriusXM,,,https://www.siriusxm.com/sports/nba,-1.0,0.0,,,,,,,,,,,home,tv,1001240.0,FanDuel Sports Network - Sun,FDSNSU,,,https://ballysports.app.link/e/vmutq8xBzNb,1610612748.0,0.0,home,radio,1000851.0,WQAM 560 / S: WAQI 710,WQAM/WAQI,,,,1610612748.0,0.0,,,,,,,,,,,away,tv,1001248.0,FanDuel Sports Network - Florida,FDSNFL,,,https://ballysports.app.link/e/UikKfgRBzNb,1610612753.0,0.0,away,radio,1000273.0,WYGM 96.9 FM / 740AM,WYGM-FM/AM,,,,1610612753.0,0.0,,,,,,,,,,
00,2024-25,10/23/2024 00:00:00,0022400066,20241023/MILPHI,3,Final,4,2024-10-23T00:00:00Z,1900-01-01T19:30:00Z,2024-10-23T19:30:00Z,2024-10-23T04:00:00Z,1900-01-01T23:30:00Z,2024-10-23T23:30:00Z,2024-10-23T18:30:00Z,2024-10-23T19:30:00Z,Wed,10,1,Week 1,false,,,,,Wells Fargo Center,PA,Philadelphia,N,,,False,1610612755,76ers,Philadelphia,PHI,sixers,0,1,109,0,1610612749,Bucks,Milwaukee,MIL,bucks,1,0,124,0,203081,Damian,Lillard,1610612749,Milwaukee,Bucks,MIL,30.0,,,,,,,,,,,,,,,,,,,,,,,,,natl,tv,2.0,ESPN,ESPN,,,https://www.espn.com/espnplus/player/_/id/fd40b68f-0f49-4258-bb00-699959936f06?ex_cid=nba,-1.0,3.0,natl,radio,1001098.0,SiriusXM,SiriusXM,,,https://www.siriusxm.com/sports/nba,-1.0,0.0,,,,,,,,,,,,,,,,,,,,,home,radio,1434.0,97.5 The Fanatic,WPEN,,,,1610612755.0,0.0,,,,,,,,,,,,,,,,,,,,,away,radio,1697.0,620 AM/103.3 FM WTMJ,WTMJ-AM/FM,,,,1610612749.0,0.0,,,,,,,,,,
00,2024-25,10/23/2024 00:00:00,0022400067,20241023/CLETOR,3,Final,5,2024-10-23T00:00:00Z,1900-01-01T19:30:00Z,2024-10-23T19:30:00Z,2024-10-23T04:00:00Z,1900-01-01T23:30:00Z,2024-10-23T23:30:00Z,2024-10-23T19:30:00Z,2024-10-23T19:30:00Z,Wed,10,1,Week 1,false,,,,,Scotiabank Arena,ON,Toronto,N,,,False,1610612761,Raptors,Toronto,TOR,raptors,0,1,106,0,1610612739,Cavaliers,Cleveland,CLE,cavaliers,1,0,136,0,1630596,Evan,Mobley,1610612739,Cleveland,Cavaliers,CLE,25.0,,,,,,,,,,,,,,,,,,,,,,,,,,,,,,,,,,,natl,radio,1001098.0,SiriusXM,SiriusXM,,,https://www.siriusxm.com/sports/nba,-1.0,0.0,,,,,,,,,,,home,tv,1563.0,SN,SN,,,,1610612761.0,0.0,home,radio,1494.0,TSN Radio 1050,CHUM,,,,1610612761.0,0.0,,,,,,,,,,,away,tv,1001232.0,FanDuel Sports Network - Ohio,FDSNOH,,,https://ballysports.app.link/e/fb7AUfpBzNb,1610612739.0,0.0,away,radio,1040.0,WTAM/WMMS,WTAM/WMMS,,,,1610612739.0,0.0,,,,,,,,,,
00,2024-25,10/23/2024 00:00:00,0022400068,20241023/CHAHOU,3,Final,6,2024-10-23T00:00:00Z,1900-01-01T20:00:00Z,2024-10-23T20:00:00Z,2024-10-23T04:00:00Z,1900-01-01T00:00:00Z,2024-10-24T00:00:00Z,2024-10-23T20:00:00Z,2024-10-23T19:00:00Z,Wed,10,1,Week 1,false,,,,,Toyota Center,TX,Houston,N,,,False,1610612745,Rockets,Houston,HOU,rockets,0,1,105,0,1610612766,Hornets,Charlotte,CHA,hornets,1,0,110,0,1630163,LaMelo,Ball,1610612766,Charlotte,Hornets,CHA,34.0,,,,,,,,,,,,,,,,,,,,,,,,,,,,,,,,,,,natl,radio,1001098.0,SiriusXM,SiriusXM,,,https://www.siriusxm.com/sports/nba,-1.0,0.0,,,,,,,,,,,home,tv,1001056.0,Space City Home Network,SCHN,,,,1610612745.0,0.0,home,radio,1000699.0,790 AM / S: 93.3 FM,KBME/KQBU-FM,,,,1610612745.0,0.0,,,,,,,,,,,away,tv,1001231.0,FanDuel Sports Network - Southeast - Charlotte,FDSNSE-CHA,,,https://ballysports.app.link/e/qqjGObnBzNb,1610612766.0,0.0,away,radio,1000862.0,WFNZ 92.7 FM,WFNZ-FM,,,,1610612766.0,0.0,,,,,,,,,,
00,2024-25,10/23/2024 00:00:00,0022400069,20241023/CHINOP,3,Final,7,2024-10-23T00:00:00Z,1900-01-01T20:00:00Z,2024-10-23T20:00:00Z,2024-10-23T04:00:00Z,1900-01-01T00:00:00Z,2024-10-24T00:00:00Z,2024-10-23T19:00:00Z,2024-10-23T19:00:00Z,Wed,10,1,Week 1,false,,,,,Smoothie King Center,LA,New Orleans,N,,,False,1610612740,Pelicans,New Orleans,NOP,pelicans,1,0,123,0,1610612741,Bulls,Chicago,CHI,bulls,0,1,111,0,1627742,Brandon,Ingram,1610612740,New Orleans,Pelicans,NOP,33.0,,,,,,,,,,,,,,,,,,,,,,,,,,,,,,,,,,,natl,radio,1001098.0,SiriusXM,SiriusXM,,,https://www.siriusxm.com/sports/nba,-1.0,0.0,,,,,,,,,,,home,tv,1001216.0,GCSEN / WVUE,GCSEN/WVUE,,,,1610612740.0,0.0,home,radio,1437.0,WWL 870 AM / 105.3 FM,WWL,,,,1610612740.0,0.0,home,ott,1001030.0,Pelicans+,DTC-NOP,,,,1610612740.0,0.0,away,tv,1001208.0,Chicago Sports Network,CHSN,,,,1610612741.0,0.0,away,radio,1687.0,670 The Score,WSCR,,,,1610612741.0,0.0,,,,,,,,,,
00,2024-25,10/23/2024 00:00:00,0022400070,20241023/MEMUTA,3,Final,8,2024-10-23T00:00:00Z,1900-01-01T21:00:00Z,2024-10-23T21:00:00Z,2024-10-23T04:00:00Z,1900-01-01T01:00:00Z,2024-10-24T01:00:00Z,2024-10-23T20:00:00Z,2024-10-23T19:00:00Z,Wed,10,1,Week 1,false,,,,,Delta Center,UT,Salt Lake City,N,,,False,1610612762,Jazz,Utah,UTA,jazz,0,1,124,0,1610612763,Grizzlies,Memphis,MEM,grizzlies,1,0,126,0,1628374,Lauri,Markkanen,1610612762,Utah,Jazz,UTA,35.0,,,,,,,,,,,,,,,,,,,,,,,,,,,,,,,,,,,natl,radio,1001098.0,SiriusXM,SiriusXM,,,https://www.siriusxm.com/sports/nba,-1.0,0.0,,,,,,,,,,,home,tv,122.0,KJZZ,KJZZ,,,,1610612762.0,0.0,home,radio,1001084.0,KSL 97.5 FM / S: KBMG 106.3 FM,KSL-FM/KBMG,,,,1610612762.0,0.0,home,ott,1001035.0,Jazz+,DTC-UTA,,,,1610612762.0,0.0,away,tv,1001239.0,FanDuel Sports Network - Southeast - Memphis,FDSNSE-MEM,,,https://ballysports.app.link/e/eSDFqowBzNb,1610612763.0,0.0,away,radio,1000152.0,ESPN 92.9FM/680AM,WMFS,,,,1610612763.0,0.0,,,,,,,,,,
00,2024-25,10/23/2024 00:00:00,0022400071,20241023/PHXLAC,3,Final/OT,9,2024-10-23T00:00:00Z,1900-01-01T22:00:00Z,2024-10-23T22:00:00Z,2024-10-23T04:00:00Z,1900-01-01T02:00:00Z,2024-10-24T02:00:00Z,2024-10-23T19:00:00Z,2024-10-23T19:00:00Z,Wed,10,1,Week 1,false,,,,,Intuit Dome,CA,Inglewood,N,,,False,1610612746,Clippers,LA,LAC,clippers,0,1,113,0,1610612756,Suns,Phoenix,PHX,suns,1,0,116,0,201935,James,Harden,1610612746,LA,Clippers,LAC,29.0,,,,,,,,,,,,,,,,,,,,,,,,,natl,tv,2.0,ESPN,ESPN,,,https://www.espn.com/espnplus/player/_/id/ad37478a-091c-4a10-acfe-f92f1668d2b0?ex_cid=nba,-1.0,3.0,natl,radio,1001098.0,SiriusXM,SiriusXM,,,https://www.siriusxm.com/sports/nba,-1.0,0.0,,,,,,,,,,,home,tv,1001237.0,FanDuel Sports Network - SoCal,FDSNSC,,,https://ballysports.app.link/e/v1u3ewuBzNb,1610612746.0,0.0,home,radio,1000288.0,AM 570 KLAC/S: KWKW,KLAC/KWKW-LAC,,,,1610612746.0,0.0,home,ott,1001036.0,ClipperVision,DTC-LAC,,,,1610612746.0,0.0,away,tv,1000998.0,Arizona's Family 3TV / Arizona's Family Sports,KTVK/KPHE,,,,1610612756.0,0.0,away,radio,1598.0,KMVP 98.7 / S: KSUN,KMVP/KSUN,,,,1610612756.0,0.0,away,ott,1001033.0,Suns Live,DTC-PHX,,,,1610612756.0,0.0
00,2024-25,10/23/2024 00:00:00,0022400072,20241023/GSWPOR,3,Final,10,2024-10-23T00:00:00Z,1900-01-01T22:00:00Z,2024-10-23T22:00:00Z,2024-10-23T04:00:00Z,1900-01-01T02:00:00Z,2024-10-24T02:00:00Z,2024-10-23T19:00:00Z,2024-10-23T19:00:00Z,Wed,10,1,Week 1,false,,,,,Moda Center,OR,Portland,N,,,False,1610612757,Trail Blazers,Portland,POR,blazers,0,1,104,0,1610612744,Warriors,Golden State,GSW,warriors,1,0,140,0,1627741,Buddy,Hield,1610612744,Golden State,Warriors,GSW,22.0,1630703.0,Scoot,Henderson,1610612757.0,Portland,Trail Blazers,POR,22.0,,,,,,,,,,,,,,,,,,,,,,,,,,,natl,radio,1001098.0,SiriusXM,SiriusXM,,,https://www.siriusxm.com/sports/nba,-1.0,0.0,,,,,,,,,,,home,tv,1001218.0,KATU 2.2,KATU.2,,,,1610612757.0,0.0,home,radio,1472.0,Rip City Radio 620,KPOJ,,,,1610612757.0,0.0,home,ott,1001128.0,BlazerVision,DTC-POR,,,,1610612757.0,0.0,away,tv,1097.0,NBCSBA,NBCSBA,,,http://stream.nbcsports.com/rsn/nba-warriors-live-stream,1610612744.0,0.0,away,radio,1597.0,95.7 The Game,KGMZ-FM,,,,1610612744.0,0.0,,,,,,,,,,
00,2024-25,10/24/2024 00:00:00,0022400073,20241024/BOSWAS,3,Final,1,2024-10-24T00:00:00Z,1900-01-01T19:00:00Z,2024-10-24T19:00:00Z,2024-10-24T04:00:00Z,1900-01-01T23:00:00Z,2024-10-24T23:00:00Z,2024-10-24T19:00:00Z,2024-10-24T19:00:00Z,Thu,10,1,Week 1,false,,,,,Capital One Arena,DC,Washington,N,,,False,1610612764,Wizards,Washington,WAS,wizards,0,1,102,0,1610612738,Celtics,Boston,BOS,celtics,2,0,122,0,1627759,Jaylen,Brown,1610612738,Boston,Celtics,BOS,27.0,,,,,,,,,,,,,,,,,,,,,,,,,,,,,,,,,,,natl,radio,1001098.0,SiriusXM,SiriusXM,,,https://www.siriusxm.com/sports/nba,-1.0,0.0,,,,,,,,,,,home,tv,1001046.0,Monumental Sports Network,MNMT,,,https://www.monumentalsportsnetwork.com/wizards-app-live?utm_source=nba_schedulepage&utm_medium=web_organic&utm_campaign=2425_stream_wiz,1610612764.0,0.0,home,radio,1001049.0,The Team 980 AM / WFED 1500 AM,WTEM/WFED,,,,1610612764.0,0.0,,,,,,,,,,,away,tv,1658.0,NBC SPORTS BOSTON,NBCSB,,,http://stream.nbcsports.com/rsn/nba-celtics-live-stream,1610612738.0,0.0,away,radio,1720.0,WROR (105.7 FM),WROR,,,,1610612738.0,0.0,,,,,,,,,,
00,2024-25,10/24/2024 00:00:00,0022400074,20241024/SASDAL,3,Final,2,2024-10-24T00:00:00Z,1900-01-01T19:30:00Z,2024-10-24T19:30:00Z,2024-10-24T04:00:00Z,1900-01-01T23:30:00Z,2024-10-24T23:30:00Z,2024-10-24T18:30:00Z,2024-10-24T18:30:00Z,Thu,10,1,Week 1,false,,,,,American Airlines Center,TX,Dallas,N,,,False,1610612742,Mavericks,Dallas,DAL,mavericks,1,0,120,0,1610612759,Spurs,San Antonio,SAS,spurs,0,1,109,0,1629029,Luka,Doncic,1610612742,Dallas,Mavericks,DAL,28.0,,,,,,,,,,,,,,,,,,,,,,,,,natl,tv,1001321.0,TNT/Max,TNT/Max,,,https://www.tntdrama.com/nba-on-tnt,-1.0,0.0,natl,radio,1001098.0,SiriusXM,SiriusXM,,,https://www.siriusxm.com/sports/nba,-1.0,0.0,,,,,,,,,,,,,,,,,,,,,home,radio,1000695.0,97.1 FM / S: 99.1 FM,KEGL/KFZO,,,,1610612742.0,0.0,,,,,,,,,,,,,,,,,,,,,away,radio,1000260.0,WOAI/KXTN,WOAI/KXTN,,,,1610612759.0,0.0,,,,,,,,,,
00,2024-25,10/24/2024 00:00:00,0022400075,20241024/OKCDEN,3,Final,3,2024-10-24T00:00:00Z,1900-01-01T22:00:00Z,2024-10-24T22:00:00Z,2024-10-24T04:00:00Z,1900-01-01T02:00:00Z,2024-10-25T02:00:00Z,2024-10-24T21:00:00Z,2024-10-24T20:00:00Z,Thu,10,1,Week 1,false,,,,,Ball Arena,CO,Denver,N,,,False,1610612743,Nuggets,Denver,DEN,nuggets,0,1,87,0,1610612760,Thunder,Oklahoma City,OKC,thunder,1,0,102,0,1628983,Shai,Gilgeous-Alexander,1610612760,Oklahoma City,Thunder,OKC,28.0,,,,,,,,,,,,,,,,,,,,,,,,,natl,tv,1001321.0,TNT/Max,TNT/Max,,,https://www.tntdrama.com/nba-on-tnt,-1.0,0.0,natl,radio,1001098.0,SiriusXM,SiriusXM,,,https://www.siriusxm.com/sports/nba,-1.0,0.0,,,,,,,,,,,,,,,,,,,,,home,radio,1730.0,Altitude Sports Radio 92.5 FM,KKSE-FM,,,,1610612743.0,0.0,,,,,,,,,,,,,,,,,,,,,away,radio,1140.0,WWLS 98.1FM OKC,WWLS,,,,1610612760.0,0.0,,,,,,,,,,
00,2024-25,10/24/2024 00:00:00,0022400076,20241024/MINSAC,3,Final,4,2024-10-24T00:00:00Z,1900-01-01T22:00:00Z,2024-10-24T22:00:00Z,2024-10-24T04:00:00Z,1900-01-01T02:00:00Z,2024-10-25T02:00:00Z,2024-10-24T21:00:00Z,2024-10-24T19:00:00Z,Thu,10,1,Week 1,false,,,,,Golden 1 Center,CA,Sacramento,N,,,False,1610612758,Kings,Sacramento,SAC,kings,0,1,115,0,1610612750,Timberwolves,Minnesota,MIN,timberwolves,1,1,117,0,203944,Julius,Randle,1610612750,Minnesota,Timberwolves,MIN,33.0,,,,,,,,,,,,,,,,,,,,,,,,,,,,,,,,,,,natl,radio,1001098.0,SiriusXM,SiriusXM,,,https://www.siriusxm.com/sports/nba,-1.0,0.0,,,,,,,,,,,home,tv,1027.0,NBCSCA,NBCSCA,,,http://stream.nbcsports.com/rsn/nba-kings-live-stream,1610612758.0,0.0,home,radio,1052.0,Sactown Sports 1140 AM,KHTK,,,,1610612758.0,0.0,,,,,,,,,,,away,tv,1001244.0,FanDuel Sports Network - North,FDSNNO,,,https://ballysports.app.link/e/OgvWXqNBzNb,1610612750.0,0.0,away,radio,1001099.0,KFAN FM / Wolves App / iHeart Radio,KFAN/Apps,,,,1610612750.0,0.0,,,,,,,,,,
00,2024-25,10/25/2024 00:00:00,0022400077,20241025/BKNORL,3,Final,1,2024-10-25T00:00:00Z,1900-01-01T19:00:00Z,2024-10-25T19:00:00Z,2024-10-25T04:00:00Z,1900-01-01T23:00:00Z,2024-10-25T23:00:00Z,2024-10-25T19:00:00Z,2024-10-25T19:00:00Z,Fri,10,1,Week 1,false,,,,,Kia Center,FL,Orlando,N,,,False,1610612753,Magic,Orlando,ORL,magic,2,0,116,0,1610612751,Nets,Brooklyn,BKN,nets,0,2,101,0,1630532,Franz,Wagner,1610612753,Orlando,Magic,ORL,29.0,,,,,,,,,,,,,,,,,,,,,,,,,,,,,,,,,,,natl,radio,1001098.0,SiriusXM,SiriusXM,,,https://www.siriusxm.com/sports/nba,-1.0,0.0,,,,,,,,,,,home,tv,1001248.0,FanDuel Sports Network - Florida,FDSNFL,,,https://ballysports.app.link/e/UikKfgRBzNb,1610612753.0,0.0,home,radio,1000273.0,WYGM 96.9 FM / 740AM,WYGM-FM/AM,,,,1610612753.0,0.0,,,,,,,,,,,away,tv,175.0,YES,YES,,,http://onelink.to/yesapp?rel=2020-21_BKN_Schedule&utm_source=brooklynnetsApp&utm_[...]medium=web&utm_campaign=2020-21_BKN_Schedule&utm_content=YesApp,1610612751.0,0.0,away,radio,1020.0,WFAN,WFAN,,,,1610612751.0,0.0,,,,,,,,,,
00,2024-25,10/25/2024 00:00:00,0022400078,20241025/PHITOR,3,Final,2,2024-10-25T00:00:00Z,1900-01-01T19:00:00Z,2024-10-25T19:00:00Z,2024-10-25T04:00:00Z,1900-01-01T23:00:00Z,2024-10-25T23:00:00Z,2024-10-25T19:00:00Z,2024-10-25T19:00:00Z,Fri,10,1,Week 1,false,,,,,Scotiabank Arena,ON,Toronto,N,,,False,1610612761,Raptors,Toronto,TOR,raptors,1,1,115,0,1610612755,76ers,Philadelphia,PHI,sixers,0,2,107,0,1626162,Kelly,Oubre Jr.,1610612755,Philadelphia,76ers,PHI,28.0,,,,,,,,,,,,,,,,,,,,,,,,,,,,,,,,,,,natl,radio,1001098.0,SiriusXM,SiriusXM,,,https://www.siriusxm.com/sports/nba,-1.0,0.0,,,,,,,,,,,home,tv,11.0,TSN,TSN,,,,1610612761.0,0.0,home,radio,1053.0,Sportsnet 590,CJCL,,,,1610612761.0,0.0,,,,,,,,,,,away,tv,133.0,NBC Sports Philadelphia,NBCSP,,,http://stream.nbcsports.com/rsn/nba-76ers-live-stream,1610612755.0,0.0,away,radio,1434.0,97.5 The Fanatic,WPEN,,,,1610612755.0,0.0,,,,,,,,,,
00,2024-25,10/25/2024 00:00:00,0022400079,20241025/CHAATL,3,Final,3,2024-10-25T00:00:00Z,1900-01-01T19:30:00Z,2024-10-25T19:30:00Z,2024-10-25T04:00:00Z,1900-01-01T23:30:00Z,2024-10-25T23:30:00Z,2024-10-25T19:30:00Z,2024-10-25T19:30:00Z,Fri,10,1,Week 1,false,,,,,State Farm Arena,GA,Atlanta,N,,,False,1610612737,Hawks,Atlanta,ATL,hawks,2,0,125,0,1610612766,Hornets,Charlotte,CHA,hornets,1,1,120,0,1629027,Trae,Young,1610612737,Atlanta,Hawks,ATL,38.0,,,,,,,,,,,,,,,,,,,,,,,,,,,,,,,,,,,natl,radio,1001098.0,SiriusXM,SiriusXM,,,https://www.siriusxm.com/sports/nba,-1.0,0.0,,,,,,,,,,,home,tv,1001230.0,FanDuel Sports Network - Southeast - Atlanta,FDSNSE-ATL,,,https://ballysports.app.link/e/KxYo4n8AzNb,1610612737.0,0.0,home,radio,1491.0,WZGC,WZGC,,,,1610612737.0,0.0,,,,,,,,,,,away,tv,1001231.0,FanDuel Sports Network - Southeast - Charlotte,FDSNSE-CHA,,,https://ballysports.app.link/e/qqjGObnBzNb,1610612766.0,0.0,away,radio,1000862.0,WFNZ 92.7 FM,WFNZ-FM,,,,1610612766.0,0.0,,,,,,,,,,
00,2024-25,10/25/2024 00:00:00,0022400080,20241025/DETCLE,3,Final,4,2024-10-25T00:00:00Z,1900-01-01T19:30:00Z,2024-10-25T19:30:00Z,2024-10-25T04:00:00Z,1900-01-01T23:30:00Z,2024-10-25T23:30:00Z,2024-10-25T19:30:00Z,2024-10-25T19:30:00Z,Fri,10,1,Week 1,false,,,,,Rocket Mortgage FieldHouse,OH,Cleveland,N,,,False,1610612739,Cavaliers,Cleveland,CLE,cavaliers,2,0,113,0,1610612765,Pistons,Detroit,DET,pistons,0,2,101,0,1630595,Cade,Cunningham,1610612765,Detroit,Pistons,DET,33.0,,,,,,,,,,,,,,,,,,,,,,,,,,,,,,,,,,,natl,radio,1001098.0,SiriusXM,SiriusXM,,,https://www.siriusxm.com/sports/nba,-1.0,0.0,,,,,,,,,,,home,tv,1001232.0,FanDuel Sports Network - Ohio,FDSNOH,,,https://ballysports.app.link/e/fb7AUfpBzNb,1610612739.0,0.0,home,radio,1040.0,WTAM/WMMS,WTAM/WMMS,,,,1610612739.0,0.0,,,,,,,,,,,away,tv,1001235.0,FanDuel Sports Network - Detroit,FDSNDT,,,https://ballysports.app.link/e/CxRVl0qBzNb,1610612765.0,0.0,away,radio,1188.0,97.1 FM The Ticket,WXYT,,,,1610612765.0,0.0,,,,,,,,,,
00,2024-25,10/25/2024 00:00:00,0022400081,20241025/INDNYK,3,Final,5,2024-10-25T00:00:00Z,1900-01-01T19:30:00Z,2024-10-25T19:30:00Z,2024-10-25T04:00:00Z,1900-01-01T23:30:00Z,2024-10-25T23:30:00Z,2024-10-25T19:30:00Z,2024-10-25T19:30:00Z,Fri,10,1,Week 1,false,,,,,Madison Square Garden,NY,New York,N,,,False,1610612752,Knicks,New York,NYK,knicks,1,1,123,0,1610612754,Pacers,Indiana,IND,pacers,1,1,98,0,1628973,Jalen,Brunson,1610612752,New York,Knicks,NYK,26.0,,,,,,,,,,,,,,,,,,,,,,,,,natl,tv,2.0,ESPN,ESPN,,,https://www.espn.com/espnplus/player/_/id/6501f3c9-ab6f-4c1a-8958-a8a970156c53?ex_cid=nba,-1.0,3.0,natl,radio,1001098.0,SiriusXM,SiriusXM,,,https://www.siriusxm.com/sports/nba,-1.0,0.0,,,,,,,,,,,home,tv,100.0,MSG,MSG,,,https://msgplus.onelink.me/sNip/BroadcastNBA,1610612752.0,0.0,home,radio,1001199.0,880 ESPN New York,WHSQ,,,,1610612752.0,0.0,,,,,,,,,,,away,tv,1001236.0,FanDuel Sports Network - Indiana,FDSNIN,,,https://ballysports.app.link/xG8hdGzvoNb,1610612754.0,0.0,away,radio,1641.0,93.5/107.5 The Fan,WFNI-FM/AM,,,,1610612754.0,0.0,,,,,,,,,,
00,2024-25,10/25/2024 00:00:00,0022400082,20241025/MEMHOU,3,Final,6,2024-10-25T00:00:00Z,1900-01-01T20:00:00Z,2024-10-25T20:00:00Z,2024-10-25T04:00:00Z,1900-01-01T00:00:00Z,2024-10-26T00:00:00Z,2024-10-25T19:00:00Z,2024-10-25T19:00:00Z,Fri,10,1,Week 1,false,,,,,Toyota Center,TX,Houston,N,,,False,1610612745,Rockets,Houston,HOU,rockets,1,1,128,0,1610612763,Grizzlies,Memphis,MEM,grizzlies,1,1,108,0,1629630,Ja,Morant,1610612763,Memphis,Grizzlies,MEM,24.0,,,,,,,,,,,,,,,,,,,,,,,,,,,,,,,,,,,natl,radio,1001098.0,SiriusXM,SiriusXM,,,https://www.siriusxm.com/sports/nba,-1.0,0.0,,,,,,,,,,,home,tv,1001056.0,Space City Home Network,SCHN,,,,1610612745.0,0.0,home,radio,1000699.0,790 AM / S: 93.3 FM,KBME/KQBU-FM,,,,1610612745.0,0.0,,,,,,,,,,,away,tv,1001239.0,FanDuel Sports Network - Southeast - Memphis,FDSNSE-MEM,,,https://ballysports.app.link/e/eSDFqowBzNb,1610612763.0,0.0,away,radio,1000152.0,ESPN 92.9FM/680AM,WMFS,,,,1610612763.0,0.0,,,,,,,,,,
00,2024-25,10/25/2024 00:00:00,0022400083,20241025/CHIMIL,3,Final,7,2024-10-25T00:00:00Z,1900-01-01T20:00:00Z,2024-10-25T20:00:00Z,2024-10-25T04:00:00Z,1900-01-01T00:00:00Z,2024-10-26T00:00:00Z,2024-10-25T19:00:00Z,2024-10-25T19:00:00Z,Fri,10,1,Week 1,false,,,,,Fiserv Forum,WI,Milwaukee,N,,,False,1610612749,Bucks,Milwaukee,MIL,bucks,1,1,122,0,1610612741,Bulls,Chicago,CHI,bulls,1,1,133,0,203507,Giannis,Antetokounmpo,1610612749,Milwaukee,Bucks,MIL,38.0,,,,,,,,,,,,,,,,,,,,,,,,,,,,,,,,,,,natl,radio,1001098.0,SiriusXM,SiriusXM,,,https://www.siriusxm.com/sports/nba,-1.0,0.0,,,,,,,,,,,home,tv,1001241.0,FanDuel Sports Network - Wisconsin,FDSNWI,,,https://ballysports.app.link/e/eu4onNABzNb,1610612749.0,0.0,home,radio,1697.0,620 AM/103.3 FM WTMJ,WTMJ-AM/FM,,,,1610612749.0,0.0,,,,,,,,,,,away,tv,1001208.0,Chicago Sports Network,CHSN,,,,1610612741.0,0.0,away,radio,1687.0,670 The Score,WSCR,,,,1610612741.0,0.0,,,,,,,,,,
00,2024-25,10/25/2024 00:00:00,0022400084,20241025/GSWUTA,3,Final,8,2024-10-25T00:00:00Z,1900-01-01T21:30:00Z,2024-10-25T21:30:00Z,2024-10-25T04:00:00Z,1900-01-01T01:30:00Z,2024-10-26T01:30:00Z,2024-10-25T18:30:00Z,2024-10-25T19:30:00Z,Fri,10,1,Week 1,false,,,,,Delta Center,UT,Salt Lake City,N,,,False,1610612762,Jazz,Utah,UTA,jazz,0,2,86,0,1610612744,Warriors,Golden State,GSW,warriors,2,0,127,0,1627741,Buddy,Hield,1610612744,Golden State,Warriors,GSW,27.0,,,,,,,,,,,,,,,,,,,,,,,,,,,,,,,,,,,natl,radio,1001098.0,SiriusXM,SiriusXM,,,https://www.siriusxm.com/sports/nba,-1.0,0.0,,,,,,,,,,,home,tv,122.0,KJZZ,KJZZ,,,,1610612762.0,0.0,home,radio,1001084.0,KSL 97.5 FM / S: KBMG 106.3 FM,KSL-FM/KBMG,,,,1610612762.0,0.0,home,ott,1001035.0,Jazz+,DTC-UTA,,,,1610612762.0,0.0,away,tv,1097.0,NBCSBA,NBCSBA,,,http://stream.nbcsports.com/rsn/nba-warriors-live-stream,1610612744.0,0.0,away,radio,1597.0,95.7 The Game,KGMZ-FM,,,,1610612744.0,0.0,,,,,,,,,,
00,2024-25,10/25/2024 00:00:00,0022400085,20241025/PHXLAL,3,Final,9,2024-10-25T00:00:00Z,1900-01-01T22:00:00Z,2024-10-25T22:00:00Z,2024-10-25T04:00:00Z,1900-01-01T02:00:00Z,2024-10-26T02:00:00Z,2024-10-25T19:00:00Z,2024-10-25T19:00:00Z,Fri,10,1,Week 1,false,,,,,Crypto.com Arena,CA,Los Angeles,N,,,False,1610612747,Lakers,Los Angeles,LAL,lakers,2,0,123,0,1610612756,Suns,Phoenix,PHX,suns,1,1,116,0,203076,Anthony,Davis,1610612747,Los Angeles,Lakers,LAL,35.0,,,,,,,,,,,,,,,,,,,,,,,,,natl,tv,2.0,ESPN,ESPN,,,https://www.espn.com/espnplus/player/_/id/0af4538e-1bd7-4b68-93c1-a7f54e5ed71c?ex_cid=nba,-1.0,3.0,natl,radio,1001098.0,SiriusXM,SiriusXM,,,https://www.siriusxm.com/sports/nba,-1.0,0.0,,,,,,,,,,,home,tv,1651.0,Spectrum SportsNet,SPECSN,,,https://spectrumsportsnet.com/watch/live/spectrum-sportsnet?cid=nba_laker_team_page,1610612747.0,0.0,home,radio,1000286.0,ESPN LA 710/1330 KWKW,KSPN/KWKW-LAL,,,,1610612747.0,0.0,home,ott,1001037.0,Spectrum SportsNet+,DTC-LAL,,,,1610612747.0,0.0,,,,,,,,,,,away,radio,1598.0,KMVP 98.7 / S: KSUN,KMVP/KSUN,,,,1610612756.0,0.0,,,,,,,,,,
00,2024-25,10/25/2024 00:00:00,0022400086,20241025/NOPPOR,3,Final,10,2024-10-25T00:00:00Z,1900-01-01T22:00:00Z,2024-10-25T22:00:00Z,2024-10-25T04:00:00Z,1900-01-01T02:00:00Z,2024-10-26T02:00:00Z,2024-10-25T21:00:00Z,2024-10-25T19:00:00Z,Fri,10,1,Week 1,false,,,,,Moda Center,OR,Portland,N,,,False,1610612757,Trail Blazers,Portland,POR,blazers,0,2,103,0,1610612740,Pelicans,New Orleans,NOP,pelicans,2,0,105,0,203924,Jerami,Grant,1610612757,Portland,Trail Blazers,POR,34.0,,,,,,,,,,,,,,,,,,,,,,,,,,,,,,,,,,,natl,radio,1001098.0,SiriusXM,SiriusXM,,,https://www.siriusxm.com/sports/nba,-1.0,0.0,,,,,,,,,,,home,tv,1001218.0,KATU 2.2,KATU.2,,,,1610612757.0,0.0,home,radio,1472.0,Rip City Radio 620,KPOJ,,,,1610612757.0,0.0,home,ott,1001128.0,BlazerVision,DTC-POR,,,,1610612757.0,0.0,away,tv,1001211.0,GCSEN,GCSEN,,,,1610612740.0,0.0,away,radio,1001198.0,WWL 870 AM,WWL-AM,,,,1610612740.0,0.0,away,ott,1001030.0,Pelicans+,DTC-NOP,,,,1610612740.0,0.0
00,2024-25,10/26/2024 00:00:00,0022400087,20241026/LACDEN,3,Final,1,2024-10-26T00:00:00Z,1900-01-01T17:00:00Z,2024-10-26T17:00:00Z,2024-10-26T04:00:00Z,1900-01-01T21:00:00Z,2024-10-26T21:00:00Z,2024-10-26T14:00:00Z,2024-10-26T15:00:00Z,Sat,10,1,Week 1,false,,,,,Ball Arena,CO,Denver,N,,,False,1610612743,Nuggets,Denver,DEN,nuggets,0,2,104,0,1610612746,Clippers,LA,LAC,clippers,1,1,109,0,203999,Nikola,Jokic,1610612743,Denver,Nuggets,DEN,41.0,,,,,,,,,,,,,,,,,,,,,,,,,natl,tv,7.0,NBA TV,NBA TV,,,,-1.0,0.0,natl,radio,1001098.0,SiriusXM,SiriusXM,,,https://www.siriusxm.com/sports/nba,-1.0,0.0,,,,,,,,,,,home,tv,1014.0,Altitude,ALT,,,,1610612743.0,0.0,home,radio,1730.0,Altitude Sports Radio 92.5 FM,KKSE-FM,,,,1610612743.0,0.0,,,,,,,,,,,away,tv,1001237.0,FanDuel Sports Network - SoCal,FDSNSC,,,https://ballysports.app.link/e/v1u3ewuBzNb,1610612746.0,0.0,away,radio,1000321.0,KEIB 1150 / S: KWKW,KEIB-AM/KWKW-LAC,,,,1610612746.0,0.0,away,ott,1001036.0,ClipperVision,DTC-LAC,,,,1610612746.0,0.0
00,2024-25,10/26/2024 00:00:00,0022400088,20241026/MIACHA,3,Final,2,2024-10-26T00:00:00Z,1900-01-01T19:00:00Z,2024-10-26T19:00:00Z,2024-10-26T04:00:00Z,1900-01-01T23:00:00Z,2024-10-26T23:00:00Z,2024-10-26T19:00:00Z,2024-10-26T19:00:00Z,Sat,10,1,Week 1,false,,,,,Spectrum Center,NC,Charlotte,N,,,False,1610612766,Hornets,Charlotte,CHA,hornets,1,2,106,0,1610612748,Heat,Miami,MIA,heat,1,1,114,0,1630163,LaMelo,Ball,1610612766,Charlotte,Hornets,CHA,27.0,,,,,,,,,,,,,,,,,,,,,,,,,,,,,,,,,,,natl,radio,1001098.0,SiriusXM,SiriusXM,,,https://www.siriusxm.com/sports/nba,-1.0,0.0,,,,,,,,,,,home,tv,1001231.0,FanDuel Sports Network - Southeast - Charlotte,FDSNSE-CHA,,,https://ballysports.app.link/e/qqjGObnBzNb,1610612766.0,0.0,home,radio,1000862.0,WFNZ 92.7 FM,WFNZ-FM,,,,1610612766.0,0.0,,,,,,,,,,,away,tv,1001240.0,FanDuel Sports Network - Sun,FDSNSU,,,https://ballysports.app.link/e/vmutq8xBzNb,1610612748.0,0.0,away,radio,1000926.0,Power 96 (WPOW 96.5) / S: WAQI 710,WPOW/WAQI,,,,1610612748.0,0.0,,,,,,,,,,
00,2024-25,10/26/2024 00:00:00,0022400089,20241026/BOSDET,3,Final,3,2024-10-26T00:00:00Z,1900-01-01T19:00:00Z,2024-10-26T19:00:00Z,2024-10-26T04:00:00Z,1900-01-01T23:00:00Z,2024-10-26T23:00:00Z,2024-10-26T19:00:00Z,2024-10-26T19:00:00Z,Sat,10,1,Week 1,false,,,,,Little Caesars Arena,MI,Detroit,N,,,False,1610612765,Pistons,Detroit,DET,pistons,0,3,118,0,1610612738,Celtics,Boston,BOS,celtics,3,0,124,0,1628369,Jayson,Tatum,1610612738,Boston,Celtics,BOS,37.0,,,,,,,,,,,,,,,,,,,,,,,,,,,,,,,,,,,natl,radio,1001098.0,SiriusXM,SiriusXM,,,https://www.siriusxm.com/sports/nba,-1.0,0.0,,,,,,,,,,,home,tv,1001235.0,FanDuel Sports Network - Detroit,FDSNDT,,,https://ballysports.app.link/e/CxRVl0qBzNb,1610612765.0,0.0,home,radio,1000856.0,91.7 FM or 98.7 FM,WXYT/WDZH,,,,1610612765.0,0.0,,,,,,,,,,,away,tv,1658.0,NBC SPORTS BOSTON,NBCSB,,,http://stream.nbcsports.com/rsn/nba-celtics-live-stream,1610612738.0,0.0,away,radio,1720.0,WROR (105.7 FM),WROR,,,,1610612738.0,0.0,,,,,,,,,,
00,2024-25,10/26/2024 00:00:00,0022400090,20241026/CLEWAS,3,Final,4,2024-10-26T00:00:00Z,1900-01-01T19:00:00Z,2024-10-26T19:00:00Z,2024-10-26T04:00:00Z,1900-01-01T23:00:00Z,2024-10-26T23:00:00Z,2024-10-26T19:00:00Z,2024-10-26T19:00:00Z,Sat,10,1,Week 1,false,,,,,Capital One Arena,DC,Washington,N,,,False,1610612764,Wizards,Washington,WAS,wizards,0,2,116,0,1610612739,Cavaliers,Cleveland,CLE,cavaliers,3,0,135,0,1628378,Donovan,Mitchell,1610612739,Cleveland,Cavaliers,CLE,30.0,,,,,,,,,,,,,,,,,,,,,,,,,,,,,,,,,,,natl,radio,1001098.0,SiriusXM,SiriusXM,,,https://www.siriusxm.com/sports/nba,-1.0,0.0,,,,,,,,,,,home,tv,1001046.0,Monumental Sports Network,MNMT,,,https://www.monumentalsportsnetwork.com/wizards-app-live?utm_source=nba_schedulepage&utm_medium=web_organic&utm_campaign=2425_stream_wiz,1610612764.0,0.0,home,radio,1001049.0,The Team 980 AM / WFED 1500 AM,WTEM/WFED,,,,1610612764.0,0.0,,,,,,,,,,,away,tv,1001232.0,FanDuel Sports Network - Ohio,FDSNOH,,,https://ballysports.app.link/e/fb7AUfpBzNb,1610612739.0,0.0,away,radio,1040.0,WTAM/WMMS,WTAM/WMMS,,,,1610612739.0,0.0,,,,,,,,,,
00,2024-25,10/26/2024 00:00:00,0022400091,20241026/OKCCHI,3,Final,5,2024-10-26T00:00:00Z,1900-01-01T20:00:00Z,2024-10-26T20:00:00Z,2024-10-26T04:00:00Z,1900-01-01T00:00:00Z,2024-10-27T00:00:00Z,2024-10-26T19:00:00Z,2024-10-26T19:00:00Z,Sat,10,1,Week 1,false,,,,,United Center,IL,Chicago,N,,,False,1610612741,Bulls,Chicago,CHI,bulls,1,2,95,0,1610612760,Thunder,Oklahoma City,OKC,thunder,2,0,114,0,1631114,Jalen,Williams,1610612760,Oklahoma City,Thunder,OKC,24.0,,,,,,,,,,,,,,,,,,,,,,,,,,,,,,,,,,,natl,radio,1001098.0,SiriusXM,SiriusXM,,,https://www.siriusxm.com/sports/nba,-1.0,0.0,,,,,,,,,,,home,tv,1001208.0,Chicago Sports Network,CHSN,,,,1610612741.0,0.0,home,radio,1688.0,670 AM / S: 1200 AM,WSCR/WRTO,,,,1610612741.0,0.0,,,,,,,,,,,away,tv,1001245.0,FanDuel Sports Network - Oklahoma,FDSNOK,,,https://ballysports.app.link/e/dGkEcoPBzNb,1610612760.0,0.0,away,radio,1140.0,WWLS 98.1FM OKC,WWLS,,,,1610612760.0,0.0,,,,,,,,,,
00,2024-25,10/26/2024 00:00:00,0022400092,20241026/ORLMEM,3,Final,6,2024-10-26T00:00:00Z,1900-01-01T20:00:00Z,2024-10-26T20:00:00Z,2024-10-26T04:00:00Z,1900-01-01T00:00:00Z,2024-10-27T00:00:00Z,2024-10-26T20:00:00Z,2024-10-26T19:00:00Z,Sat,10,1,Week 1,false,,,,,FedExForum,TN,Memphis,N,,,False,1610612763,Grizzlies,Memphis,MEM,grizzlies,2,1,124,0,1610612753,Magic,Orlando,ORL,magic,2,1,111,0,1630532,Franz,Wagner,1610612753,Orlando,Magic,ORL,23.0,,,,,,,,,,,,,,,,,,,,,,,,,natl,tv,7.0,NBA TV,NBA TV,,,,-1.0,0.0,natl,radio,1001098.0,SiriusXM,SiriusXM,,,https://www.siriusxm.com/sports/nba,-1.0,0.0,,,,,,,,,,,home,tv,1001239.0,FanDuel Sports Network - Southeast - Memphis,FDSNSE-MEM,,,https://ballysports.app.link/e/eSDFqowBzNb,1610612763.0,0.0,home,radio,1000152.0,ESPN 92.9FM/680AM,WMFS,,,,1610612763.0,0.0,,,,,,,,,,,away,tv,1001248.0,FanDuel Sports Network - Florida,FDSNFL,,,https://ballysports.app.link/e/UikKfgRBzNb,1610612753.0,0.0,away,radio,1000273.0,WYGM 96.9 FM / 740AM,WYGM-FM/AM,,,,1610612753.0,0.0,,,,,,,,,,
00,2024-25,10/26/2024 00:00:00,0022400093,20241026/TORMIN,3,Final,7,2024-10-26T00:00:00Z,1900-01-01T20:00:00Z,2024-10-26T20:00:00Z,2024-10-26T04:00:00Z,1900-01-01T00:00:00Z,2024-10-27T00:00:00Z,2024-10-26T20:00:00Z,2024-10-26T19:00:00Z,Sat,10,1,Week 1,false,,,,,Target Center,MN,Minneapolis,N,,,False,1610612750,Timberwolves,Minnesota,MIN,timberwolves,2,1,112,0,1610612761,Raptors,Toronto,TOR,raptors,1,2,101,0,1641711,Gradey,Dick,1610612761,Toronto,Raptors,TOR,25.0,,,,,,,,,,,,,,,,,,,,,,,,,,,,,,,,,,,natl,radio,1001098.0,SiriusXM,SiriusXM,,,https://www.siriusxm.com/sports/nba,-1.0,0.0,,,,,,,,,,,home,tv,1001244.0,FanDuel Sports Network - North,FDSNNO,,,https://ballysports.app.link/e/OgvWXqNBzNb,1610612750.0,0.0,home,radio,1001099.0,KFAN FM / Wolves App / iHeart Radio,KFAN/Apps,,,,1610612750.0,0.0,,,,,,,,,,,away,tv,11.0,TSN,TSN,,,,1610612761.0,0.0,away,radio,1053.0,Sportsnet 590,CJCL,,,,1610612761.0,0.0,,,,,,,,,,
00,2024-25,10/26/2024 00:00:00,0022400094,20241026/HOUSAS,3,Final,8,2024-10-26T00:00:00Z,1900-01-01T20:30:00Z,2024-10-26T20:30:00Z,2024-10-26T04:00:00Z,1900-01-01T00:30:00Z,2024-10-27T00:30:00Z,2024-10-26T19:30:00Z,2024-10-26T19:30:00Z,Sat,10,1,Week 1,false,,,,,Frost Bank Center,TX,San Antonio,N,,,False,1610612759,Spurs,San Antonio,SAS,spurs,1,1,109,0,1610612745,Rockets,Houston,HOU,rockets,1,2,106,0,1630224,Jalen,Green,1610612745,Houston,Rockets,HOU,29.0,1641705.0,Victor,Wembanyama,1610612759.0,San Antonio,Spurs,SAS,29.0,,,,,,,,,,,,,,,,,,,,,,,,,,,natl,radio,1001098.0,SiriusXM,SiriusXM,,,https://www.siriusxm.com/sports/nba,-1.0,0.0,,,,,,,,,,,home,tv,156.0,KENS,KENS,,,,1610612759.0,0.0,home,radio,1000260.0,WOAI/KXTN,WOAI/KXTN,,,,1610612759.0,0.0,,,,,,,,,,,away,tv,1001056.0,Space City Home Network,SCHN,,,,1610612745.0,0.0,away,radio,1000699.0,790 AM / S: 93.3 FM,KBME/KQBU-FM,,,,1610612745.0,0.0,,,,,,,,,,
00,2024-25,10/26/2024 00:00:00,0022400095,20241026/DALPHX,3,Final,9,2024-10-26T00:00:00Z,1900-01-01T22:00:00Z,2024-10-26T22:00:00Z,2024-10-26T04:00:00Z,1900-01-01T02:00:00Z,2024-10-27T02:00:00Z,2024-10-26T21:00:00Z,2024-10-26T19:00:00Z,Sat,10,1,Week 1,false,,,,,Footprint Center,AZ,Phoenix,N,,,False,1610612756,Suns,Phoenix,PHX,suns,2,1,114,0,1610612742,Mavericks,Dallas,DAL,mavericks,1,1,102,0,1629029,Luka,Doncic,1610612742,Dallas,Mavericks,DAL,40.0,,,,,,,,,,,,,,,,,,,,,,,,,,,,,,,,,,,natl,radio,1001098.0,SiriusXM,SiriusXM,,,https://www.siriusxm.com/sports/nba,-1.0,0.0,,,,,,,,,,,home,tv,1000998.0,Arizona's Family 3TV / Arizona's Family Sports,KTVK/KPHE,,,,1610612756.0,0.0,home,radio,1598.0,KMVP 98.7 / S: KSUN,KMVP/KSUN,,,,1610612756.0,0.0,home,ott,1001033.0,Suns Live,DTC-PHX,,,,1610612756.0,0.0,away,tv,1001225.0,KFAA,KFAA,,,,1610612742.0,0.0,away,radio,1000695.0,97.1 FM / S: 99.1 FM,KEGL/KFZO,,,,1610612742.0,0.0,away,ott,1001022.0,MavsTV,DTC-DAL,,,,1610612742.0,0.0
00,2024-25,10/26/2024 00:00:00,0022400096,20241026/SACLAL,3,Final,10,2024-10-26T00:00:00Z,1900-01-01T22:30:00Z,2024-10-26T22:30:00Z,2024-10-26T04:00:00Z,1900-01-01T02:30:00Z,2024-10-27T02:30:00Z,2024-10-26T19:30:00Z,2024-10-26T19:30:00Z,Sat,10,1,Week 1,false,,,,,Crypto.com Arena,CA,Los Angeles,N,,,False,1610612747,Lakers,Los Angeles,LAL,lakers,3,0,131,0,1610612758,Kings,Sacramento,SAC,kings,0,2,127,0,2544,LeBron,James,1610612747,Los Angeles,Lakers,LAL,32.0,,,,,,,,,,,,,,,,,,,,,,,,,natl,tv,7.0,NBA TV,NBA TV,,,,-1.0,0.0,natl,radio,1001098.0,SiriusXM,SiriusXM,,,https://www.siriusxm.com/sports/nba,-1.0,0.0,,,,,,,,,,,home,tv,1651.0,Spectrum SportsNet,SPECSN,,,https://spectrumsportsnet.com/watch/live/spectrum-sportsnet?cid=nba_laker_team_page,1610612747.0,0.0,home,radio,1000286.0,ESPN LA 710/1330 KWKW,KSPN/KWKW-LAL,,,,1610612747.0,0.0,home,ott,1001037.0,Spectrum SportsNet+,DTC-LAL,,,,1610612747.0,0.0,away,tv,1027.0,NBCSCA,NBCSCA,,,http://stream.nbcsports.com/rsn/nba-kings-live-stream,1610612758.0,0.0,away,radio,1052.0,Sactown Sports 1140 AM,KHTK,,,,1610612758.0,0.0,,,,,,,,,,
00,2024-25,10/27/2024 00:00:00,0022400097,20241027/PHIIND,3,Final/OT,1,2024-10-27T00:00:00Z,1900-01-01T15:30:00Z,2024-10-27T15:30:00Z,2024-10-27T04:00:00Z,1900-01-01T19:30:00Z,2024-10-27T19:30:00Z,2024-10-27T15:30:00Z,2024-10-27T15:30:00Z,Sun,10,1,Week 1,false,,,,,Gainbridge Fieldhouse,IN,Indianapolis,N,,,False,1610612754,Pacers,Indiana,IND,pacers,1,2,114,0,1610612755,76ers,Philadelphia,PHI,sixers,1,2,118,0,1630178,Tyrese,Maxey,1610612755,Philadelphia,76ers,PHI,45.0,,,,,,,,,,,,,,,,,,,,,,,,,,,,,,,,,,,natl,radio,1001098.0,SiriusXM,SiriusXM,,,https://www.siriusxm.com/sports/nba,-1.0,0.0,,,,,,,,,,,home,tv,1001236.0,FanDuel Sports Network - Indiana,FDSNIN,,,https://ballysports.app.link/xG8hdGzvoNb,1610612754.0,0.0,home,radio,1641.0,93.5/107.5 The Fan,WFNI-FM/AM,,,,1610612754.0,0.0,,,,,,,,,,,away,tv,133.0,NBC Sports Philadelphia,NBCSP,,,http://stream.nbcsports.com/rsn/nba-76ers-live-stream,1610612755.0,0.0,away,radio,1434.0,97.5 The Fanatic,WPEN,,,,1610612755.0,0.0,,,,,,,,,,
00,2024-25,10/27/2024 00:00:00,0022400098,20241027/MILBKN,3,Final,2,2024-10-27T00:00:00Z,1900-01-01T18:00:00Z,2024-10-27T18:00:00Z,2024-10-27T04:00:00Z,1900-01-01T22:00:00Z,2024-10-27T22:00:00Z,2024-10-27T17:00:00Z,2024-10-27T18:00:00Z,Sun,10,1,Week 1,false,,,,,Barclays Center,NY,Brooklyn,N,,,False,1610612751,Nets,Brooklyn,BKN,nets,1,2,115,0,1610612749,Bucks,Milwaukee,MIL,bucks,1,2,102,0,1630560,Cam,Thomas,1610612751,Brooklyn,Nets,BKN,32.0,,,,,,,,,,,,,,,,,,,,,,,,,,,,,,,,,,,natl,radio,1001098.0,SiriusXM,SiriusXM,,,https://www.siriusxm.com/sports/nba,-1.0,0.0,,,,,,,,,,,home,tv,175.0,YES,YES,,,http://onelink.to/yesapp?rel=2020-21_BKN_Schedule&utm_source=brooklynnetsApp&utm_[...]medium=web&utm_campaign=2020-21_BKN_Schedule&utm_content=YesApp,1610612751.0,0.0,home,radio,1020.0,WFAN,WFAN,,,,1610612751.0,0.0,,,,,,,,,,,away,tv,1001241.0,FanDuel Sports Network - Wisconsin,FDSNWI,,,https://ballysports.app.link/e/eu4onNABzNb,1610612749.0,0.0,away,radio,1697.0,620 AM/103.3 FM WTMJ,WTMJ-AM/FM,,,,1610612749.0,0.0,,,,,,,,,,
